class_nbr,subject,catalog_nbr,class_section,descr,catalog_description,topic,units,component,class_type,acad_career_descr,instruction_mode_descr,campus_descr,location_descr,session_descr,start_dt,end_dt,enrl_stat_descr,class_capacity,enrollment_total,enrollment_available,wait_tot,wait_cap,grading_basis,combined_section,instructors
4013,I&E,745,01,Narrative Design,"Students will learn to communicate why others should value their ideas and innovations, using both verbal and non-verbal elements. The first weeks of the seminar series will focus on common principles of storytelling and the ways in which stories have, historically, been the cornerstone of disseminating new ideas and information as far back as Homeric epic to as recently as Instagram and TikTok. Students will spend the remainder of the time in small groups to practice communication and design by creating and workshopping a variety of narrative materials (e.g. essay, podcast, video, presentation, etc.) related to their primary work or scholarship in another discipline.",,1,LEC,E,Graduate,In Person,Duke University,Durham,Regular Academic Session,01/08/2025,03/06/2025,Closed,50,56,0,0,50,Credit / No Credit,N,Amy Wyron Robinson
4010,I&E,748,01,New Ventures Discover,"This course is designed to lead you to a eureka moment by teaching you how to explore the world around you for problems worth solving. Instead of jumping directly into problem solving and solution development—which can often be wasteful without a clear understanding of a given market and customer need—this course focuses on research, exploration, and discovery. It asks students to set aside pre-conceived notions, avoiding some of their own blind spots, in order to do the necessary work of collecting data about market and learning to assess it as objectively as possible. This course is ideal for anyone who wants to excel at finding white space for new innovation and entrepreneurial action.",,3,LEC,E,Graduate,In Person,Duke University,Durham,Regular Academic Session,01/08/2025,04/16/2025,Open,40,20,20,0,40,Graded,N,Shep Moyle
4009,I&E,750,01,New Ventures Develop,"Do you want to design a business model around either your own idea or someone else's problem? In New Ventures Develop you'll learn to assess opportunities, develop and test business models, understand your financials, and build successful teams. If you've validated an idea through New Ventures Discover or through your independent customer discovery process, New Ventures Develop can facilitate idea to action. In this course, student teams will develop core elements of a strategy for a technology or business idea; detail will be suitable for a business plan document for a company seeking initial investment; strategy will serve as a foundation for a first operating plan for company.",,3,LEC,E,Graduate,In Person,Duke University,Durham,Regular Academic Session,01/08/2025,04/16/2025,Open,15,14,1,0,15,Graded,N,Jamie N Jones; Maxwell Benno Stern
10046,I&E,790,01,Special Topics,Selected topics in innovation and entrepreneurship. Consent of instructor is required.,BUILD TECH PRODUCTS,3,LEC,E,Graduate,In Person,Duke University,Durham,Regular Academic Session,01/08/2025,04/16/2025,Open,6,3,3,0,6,Graded,N,Anna Wilson
10186,I&E,791,01,Independent Study,"Individual non-research directed independent study in a field of special interest on a previously approved topic taken, under the supervision of a faculty member, and resulting in an academic and/or artistic product. Instructor consent required.",,3,IND,E,Graduate,In Person,Duke University,Durham,Regular Academic Session,01/08/2025,04/16/2025,Closed,1,1,0,0,1,Graded,N,Maxwell Benno Stern
4001,I&E,800,01,Business and Organization Fundamentals for Entrepreneurial Action,"Graduate students often have expertise in particular domains, but little business experience. Attaining business experience can take years and is often hard to navigate. Using entrepreneurship as a backdrop, this course provides a broad overview of business, including practical business fundamentals and theoretical frameworks for critical thinking. The course achieves this through theoretical frameworks, experiential education, and an analysis of competing companies. Students will experience the early stages of a typical startup, examine theoretical basis for startup success, understand managing and operating within an organization, and conduct a business analysis of competing companies.",,3,LEC,E,Graduate,In Person,Duke University,Durham,Regular Academic Session,01/08/2025,04/16/2025,Open,60,49,11,0,60,Credit / No Credit,N,Jon Fjeld
7711,I&E,835,01,Innovations in Drug Development,"Introduction to major issues in developing a drug to treat a disease in an interdisciplinary lecture-based and team-based learning environment. Translation of principles in biomedical sciences, biomedical engineering, and chemistry along with innovative approaches to develop a hypothetical drug for treating a disease of choice. Hypothetical development of model compounds, target analysis, and in vitro and in vivo models to test drug efficacy. Course requires one of the following (or equivalent): Pharmacology and Cancer Biology 533, Chemistry 518, or Biomedical Engineering 577.",,4,LEC,E,Graduate,In Person,Duke University,Durham,Regular Academic Session,01/08/2025,04/16/2025,Closed,20,20,0,0,15,Graded,Y,Tso-Pang Yao; Christopher Joseph Chidley
