class_nbr,subject,catalog_nbr,class_section,descr,catalog_description,topic,units,component,class_type,acad_career_descr,instruction_mode_descr,campus_descr,location_descr,session_descr,start_dt,end_dt,enrl_stat_descr,class_capacity,enrollment_total,enrollment_available,wait_tot,wait_cap,grading_basis,combined_section,instructors
2906,LAW,351,01,U.S. Immigration and Nationality Law,"This course reviews the body of American Immigration and Nationality Law, beginning with a survey of the history and current shape of Immigration Law. The course will address American Immigration Law in the context of the US Constitution, International law and the laws of other nations, the legislative, regulatory, and judicial process which creates, interprets, and enforces the law, and current policy concerns directing the future shape of the law.",,3,LEC,E,Law School,In Person,Duke University,Durham,Regular Academic Session,01/09/2025,04/17/2025,Open,45,42,3,0,15,Graded,N,-; Katherine L Evans
3022,LAW,356,01,Effective Communication Outside of the Courtroom,"This seminar introduces skills to make students more effective in their interpersonal communication, teamwork, and persuasive public speaking. Class sessions will feature a combination of lectures, individual and group presentations, discussion, and in-class exercises. Students will receive feedback on their performances through self-reflections, peer evaluations, and instructor evaluations. Students with have opportunities to interact with practicing lawyers, who will explain how interpersonal communication and public presentation skills shape their day-to-day responsibilities.",,2,SEM,E,Law School,In Person,Duke University,Durham,Regular Academic Session,01/15/2025,03/09/2025,Closed,12,12,0,0,7,Graded,N,Daisy L Lovelace
2845,LAW,361,01,International Trade Law,"This course will examine why the WTO is there, how it developed from the GATT to what it is now and how it fits in the wider picture of other international economic institutions such as the World Bank and the IMF (Part I).",,3,LEC,E,Law School,In Person,Duke University,Durham,Regular Academic Session,01/09/2025,04/17/2025,Open,50,29,21,0,15,Graded,N,Rachel Dougherty Brewster
3024,LAW,369,01,Patent Law and Policy,"An overview of the legal framework for patents, including statutory requirements for patentability, disclosure requirements, infringement analysis, special problems of collaborative and competitive research, international issues, and the role of patent counsel in litigation.",,3,LEC,E,Law School,In Person,Duke University,Durham,Regular Academic Session,01/09/2025,04/17/2025,Open,25,15,10,0,10,Graded,N,-; Arti K Rai
2983,LAW,370,01,Introduction to Legal Theory: Modes of Legal Argument,"Exploration of legal and constitutional interpretation: how to interpret a legal text. Formalism and textualism, purposivism, originalism, process theory, economic analysis, realism and legal pluralism. What arguments are permissible within our legal tradition? Where does law come from? What makes it legitimate? Is there a pre-existing template for market economies that frames the interpretation of the laws governing markets? How do we interpret the public/private distinction in society? Is the understanding of law affected by living in a democratic, free-market, constitutional country? These questions will be explored in context of concrete legal issues.",,3,SEM,E,Law School,In Person,Duke University,Durham,Regular Academic Session,01/09/2025,04/17/2025,Closed,12,12,0,0,5,Graded,N,James D Boyle
3000,LAW,379,01,Partnership Taxation,"The course will cover the tax consequences of organizing, operating, and liquidating entities including related issues taxed as partnerships. Law 255 Federal Taxation is a prerequisite for this course.",,3,LEC,E,Law School,In Person,Duke University,Durham,Regular Academic Session,01/09/2025,04/17/2025,Closed,14,14,0,0,7,Graded,N,Noah H Marks
2840,LAW,380,01,International Research Methods,"A survey of methods, techniques and strategies for international, foreign, and comparative legal research, including the efficient use of Lexis, Westlaw and the Internet. The subjects examined include treaty law, the law of international organizations, European Union law, civil law and other foreign legal systems. Students will complete an annotated bibliography on a topic chosen in consultation with the instructor. Course required for students enrolled in the JD/LLM in Comparative and International Law.",,1,LEC,E,Law School,In Person,Duke University,Durham,Regular Academic Session,01/09/2025,04/17/2025,Open,26,19,7,0,10,Graded,N,Michael B McArthur
2839,LAW,384,01,Securities Regulation,A study of the federal and state securities laws and the industry they govern with emphasis on the regulation of the distribution process and trading in securities.,,4,LEC,E,Law School,In Person,Duke University,Durham,Regular Academic Session,01/09/2025,04/17/2025,Open,75,61,14,0,25,Graded,N,-; James D Cox
9487,LAW,387,01,"Securities Litigation, Enforcement and Compliance","This survey course is designed to acquaint students with the theoretical as well as practical aspects of federal securities litigation, enforcement, and compliance. Prerequisite: Law 210, Business Associations. Students taking this course may not take or have taken Law 575, Securities Litigation.",,3,LEC,E,Law School,In Person,Duke University,Durham,Regular Academic Session,01/09/2025,04/17/2025,Open,40,14,26,0,10,Graded,N,-; Veronica R Martinez
3005,LAW,389,01,Insurance Law,"This course is designed to provide students with an understanding of basic insurance law concepts, particularly in the context of Commercial General Liability (CGL) insurance, the most common type of liability insurance maintained by businesses of all sizes and in all industries across the United States. Students will gain a practical understanding of insurance theory and the significance of insurance in risk management and risk transfer.",,2,LEC,E,Law School,In Person,Duke University,Durham,Regular Academic Session,01/09/2025,04/17/2025,Open,30,7,23,0,10,Graded,N,-; Richard Nicolaides
2842,LAW,390,01,Structuring and Regulating Financial Transactions,"This course examines the innovative areas of legal practice involving Structuring Commercial and Financial Trans­actions. Course examines bankruptcy, securities law, corporation law, secured transactions, finance, international capital markets, and tax.",,3,LEC,E,Law School,In Person,Duke University,Durham,Regular Academic Session,01/09/2025,04/17/2025,Open,80,79,1,0,15,Graded,N,-; Steven L Schwarcz
2926,LAW,399,01,Forensic Psychiatry,This course is designed to provide the student with a working knowledge of the major areas of interface between psychiatry and law. Basic concepts of clinical psychiatry and psychopathology will be highlighted.,,2,LEC,E,Law School,In Person,Duke University,Durham,Regular Academic Session,01/09/2025,04/17/2025,Open,18,16,2,0,7,Graded,N,-; Sally Johnson
2841,LAW,400,02,Health Justice Clinic,"In-house legal clinic in which students provide legal representation for persons with HIV/AIDS, cancer, and other serious health conditions. Under close supervision of clinical instructors, students represent clients in cases related to the client's health condition, including: estate planning; government benefits; permanency planning for children; health and disability insurance; guardianship; health-related discrimination in employment, housing and public accommodations; health information privacy; and other civil cases related to health. Clinic intensive weekend required. Prerequisite or corequisite: Law 237 or Law 238 or Law 239 or Law 317 or Law 539.",,4,CLN,E,Law School,In Person,Duke University,Durham,Regular Academic Session,01/09/2025,04/17/2025,Closed,10,10,0,0,5,Graded,N,Allison Korn; Hannah Demeritt
2848,LAW,401,02,Advanced Health Justice Clinic,"Available to students who wish to participate for a second semester in the Health Justice Clinic. Students enrolled in advanced clinical studies are required to participate fully in the case work portion of the clinic, performing 100-120 hours of client representation work, but will not be required to attend the class sessions. You must be able to attend the clinic intensive weekend to enroll in this course. Consent of clinic director required.",,1 - 2,CLN,E,Law School,In Person,Duke University,Durham,Regular Academic Session,01/09/2025,04/17/2025,Closed,2,3,0,0,0,Graded,N,Allison Korn; Hannah Demeritt
3008,LAW,408,01,Appellate Litigation Clinic - Spring,"Each team of students will, under the clinic director's supervision, work on an appeal. Work typically includes reviewing the record, legal research, drafting appellate briefs, preparing excerpts of the record for the court, and preparing for oral argument (if the case is calendared for argument). With the court's and the client's permission, a case may be argued by a student. This is a year-long course requiring enrollment in both semesters; to get credit for the fall you must be enrolled in the spring semester. Enrolled students must attend the clinic intensive weekend. For other requirements and scheduling issues, see https://law.duke.edu/curriculum/courseinfo/course/?id=293.",,3,LEC,E,Law School,In Person,Duke University,Durham,Regular Academic Session,01/09/2025,04/17/2025,Closed,6,6,0,0,3,Graded,N,Richard B Katskee
2854,LAW,416,02,Children's Law Clinic,A legal clinic focused on the representation of low income children with disabilities. Participation will require classroom training and at least 125 hours of legal work. You must be able to attend the clinic intensive weekend to enroll in this course. Prerequisite or corequisite: Law 231 or Law 237 or Law 238 or Law 239 or Law 317 or Law 539.,,4,CLN,E,Law School,In Person,Duke University,Durham,Regular Academic Session,01/09/2025,04/17/2025,Closed,10,10,0,0,5,Graded,N,Crystal M Grant; Peggy Davis Nicholson
2850,LAW,417,02,Advanced Children's Education and Law Clinic,This course is available to students who have participated in one semester of the Children's Education and Law Clinic. Students may enroll only with approval of the Director of the Clinic. Students do not have to attend the clinic intensive weekend.,,3,CLN,E,Law School,In Person,Duke University,Durham,Regular Academic Session,01/09/2025,04/17/2025,Closed,2,5,0,0,0,Graded,N,Crystal M Grant; Peggy Davis Nicholson
2857,LAW,420,01,Trial Practice,An introduction to the civil and criminal litigation process and attendant skills. Emphasis on the interactions between attorneys and witnesses and between lawyers and juries by use of simulation and videotape pedagogy. It begins with an intensive weekend of instruction. You must be able to attend the clinic intensive weekend to enroll in this course. Prerequisite: Law 245.,,3,CLN,E,Law School,In Person,Duke University,Durham,Regular Academic Session,01/09/2025,04/17/2025,Open,12,11,1,0,5,Graded,N,Donald H Beskind
2939,LAW,420,02,Trial Practice,An introduction to the civil and criminal litigation process and attendant skills. Emphasis on the interactions between attorneys and witnesses and between lawyers and juries by use of simulation and videotape pedagogy. It begins with an intensive weekend of instruction. You must be able to attend the clinic intensive weekend to enroll in this course. Prerequisite: Law 245.,,3,CLN,E,Law School,In Person,Duke University,Durham,Regular Academic Session,01/09/2025,04/17/2025,Open,12,3,9,0,5,Graded,N,Marlyn Dail; Michael R Dockterman
2851,LAW,421,02,Pre-Trial Litigation,"This course focuses on the path litigators must navigate prior to trial. We will explore the key components of the pretrial process, beginning with the filing of a law suit. This course provides an opportunity for students to synthesize their knowledge in procedure, evidence and advocacy. Topics include: drafting pleadings; taking and defending depositions; creating and responding to discovery; planning strategy and motions. The course grade will be based on classroom participation, performance and written work.",,3,CLN,E,Law School,In Person,Duke University,Durham,Regular Academic Session,01/09/2025,04/17/2025,Open,20,12,8,0,5,Graded,N,Coleman Cowan; Sarah H Ludington
9855,LAW,425,01,Pretrial Criminal Litigation,"This course focuses on the pretrial phase in criminal cases. It begins with a defendant's initial appearance and concludes with a plea hearing. Class discussions and readings will explore the pretrial practices of effective defense counsel, including conducting a defense investigation, working with experts, and managing clients. The class will also emphasize oral advocacy skills. Students will be expected to appear as counsel during mock, in-class court hearings. Finally, this course will provide students with an opportunity to familiarize themselves with criminal case pleadings, including the drafting of at least one motion.",,1,CLN,E,Law School,In Person,Duke University,Durham,Regular Academic Session,02/19/2025,04/16/2025,Closed,12,12,0,0,5,Graded,N,Jamie T Lau
2933,LAW,427,02,Community Enterprise Clinic,"This clinic will provide students interested generally in business law practice and/or in specializing in affordable housing and community development law with practical skills training in many of the core skills required in any transactional legal practice, including interviewing, counseling, drafting and negotiation. Students will be required to provide a minimum of 100 hours of legal work per semester and to participate in weekly group training meetings. You must be able to attend the clinic intensive weekend to enroll in this course. Law 210, Law 255 recommended but not required. Prerequisite or corequisite: Law 237 or Law 238 or Law 239 or Law 317 or Law 539.",,4,CLN,E,Law School,In Person,Duke University,Durham,Regular Academic Session,01/09/2025,04/17/2025,Closed,12,12,0,0,5,Graded,N,Andrew H Foster
2853,LAW,429,02,Civil Justice Clinic,"This clinic will develop and hone civil litigation skills in the context of working on actual cases in association with the Durham office of Legal Aid of North Carolina. Cases will focus on vindicating the rights of impoverished individuals or groups who cannot otherwise adequately find justice in the civil courts. Students will be directly supervised by Legal Aid attorneys, working in conjunction with the Clinic Director. Cases may include prosecuting unsafe housing claims, defense of eviction claims, prosecuting unfair trade practice claims, and a variety of other matters. All enrolled students will be required to provide a minimum of 100 hours of client legal work per semester. Prerequisite or corequisite: Law 237 or Law 238 or Law 239 or Law 317 or Law 539.",,4,CLN,E,Law School,In Person,Duke University,Durham,Regular Academic Session,01/09/2025,04/17/2025,Closed,8,8,0,0,5,Graded,N,Jesse H. McCoy II
2934,LAW,431,02,Advanced Civil Justice Clinic,"This course builds on the lectures, training, and work of the basic Civil Justice Clinic.",,1 - 2,CLN,E,Law School,In Person,Duke University,Durham,Regular Academic Session,01/09/2025,04/17/2025,Open,3,0,3,0,0,Graded,N,Jesse H. McCoy II
2935,LAW,435,02,First Amendment Clinic,"This clinic will develop counseling, litigation, and legal commentary skills in the context of working on actual cases and issues involving the First Amendment freedoms of speech, press, assembly and petition. We will advise and represent individuals and groups with First Amendment concerns or claims who cannot afford the assistance of lawyers with specialized First Amendment expertise. Either First Amendment or Dignitary Torts is a prerequisite/corequisite.",,4,CLN,E,Law School,In Person,Duke University,Durham,Regular Academic Session,01/09/2025,04/17/2025,Open,8,5,3,0,3,Graded,N,Carolyn Amanda Martin; Kyle Compton; Sarah H Ludington
2936,LAW,435A,02,Advanced First Amendment Clinic,"Continuation of Law 435, First Amendment Clinic. Instructor consent required.",,2,CLN,E,Law School,In Person,Duke University,Durham,Regular Academic Session,01/09/2025,04/17/2025,Closed,2,4,0,0,0,Graded,N,Carolyn Amanda Martin; Kyle Compton; Sarah H Ludington
2852,LAW,437,02,International Human Rights Clinic,"The International Human Rights Clinic provides students with an opportunity to critically engage with human rights issues, strategies, tactics, institutions, and law in both domestic and international settings. Through weekly seminar and fieldwork, students will develop practical tools for human rights advocacy. Prerequisite: Law 537.",,4,CLN,E,Law School,In Person,Duke University,Durham,Regular Academic Session,01/09/2025,04/17/2025,Closed,10,10,0,0,2,Graded,N,-; Aya D Fujimura-Fanselow; Jayne C Huckerby; Jillian Rafferty
2966,LAW,438,02,Advanced International Human Rights Clinic,"This course builds on the lectures, training and work of the basic International Human Rights Clinic.",,2,CLN,E,Law School,In Person,Duke University,Durham,Regular Academic Session,01/09/2025,04/17/2025,Open,4,2,2,0,0,Graded,N,-; Aya D Fujimura-Fanselow; Jayne C Huckerby; Jillian Rafferty
2847,LAW,441,02,Start-Up Ventures Clinic,The Start-Up Ventures Clinic will represent a range of early-stage ventures on a variety of matters related to the start-up process. Students must be able to attend the clinic intensive. Prerequisite or corequisite: Law 231 or Law 237 or Law 238 or Law 239 or Law 240 or Law 317 or Law 539.,,4,CLN,E,Law School,In Person,Duke University,Durham,Regular Academic Session,01/09/2025,04/17/2025,Closed,12,12,0,0,4,Graded,N,Bryan Andrew McGann; Michael T Murphy
2855,LAW,441A,02,Advanced Start Up Ventures Clinic,"The Advanced Start-Up Ventures Clinic will represent a range of early-stage ventures on a variety of matters related to the start-up process. In order to be eligible to enroll in the Clinic you must have successfully completed Law 441, Start Up Ventures Clinic.",,2 - 3,CLN,E,Law School,In Person,Duke University,Durham,Regular Academic Session,01/09/2025,04/17/2025,Open,5,2,3,0,0,Graded,N,Bryan Andrew McGann; Michael T Murphy
2849,LAW,443,02,Environmental Law and Policy Clinic,"Under the supervision of the clinical faculty, students will work on current case and policy advocacy priorities as determined by the Clinic's Intake Board. Cases and issues undertaken by the Clinic may include the following subject areas: water quality, air quality, natural resources conservation, sustainable development, public trust resources and environmental justice. Practical skills training will emphasize skills needed to counsel clients, examine witnesses and to advocate effectively in rulemaking and litigation settings. Generally, students may only enroll in the clinic for 1 semester, but may enroll for 2 semesters with the permission of the instructor if space permits. All enrolled students will be required to provide a minimum of 100 hours of work per semester to the clinic. In addition, students must participate in weekly group training meetings as well. The clinic office is located in the law school building. Law students must be in at least their fourth semester of law school to enroll in the clinic. Nicholas School students must be in at least their second semester. You must be able to attend the clinic intensive weekend to enroll in this course. Prerequisite or Corequisite: Law 237 or Law 238 or Law 239 or Law 317 or Law 539.",,4,CLN,E,Law School,In Person,Duke University,Durham,Regular Academic Session,01/09/2025,04/17/2025,Closed,7,7,0,0,4,Graded,N,Michelle Nowlin; Nancy Ellen Lauer; Ryke Longest
2856,LAW,443A,02,Advanced Environmental Law and Policy,Continuation of Law 443. You must be able to attend the clinic intensive weekend to enroll in this course.,,2 - 4,CLN,E,Law School,In Person,Duke University,Durham,Regular Academic Session,01/09/2025,04/17/2025,Open,6,1,5,0,0,Graded,N,Michelle Nowlin; Nancy Ellen Lauer; Ryke Longest
2937,LAW,445,02,Immigrant Rights Clinic,"The Immigrant Rights Clinic engages students in direct representation of clients in all forms of deportation defense. The clinic also works with community groups and other legal service providers to support impact litigation, policy advocacy, and outreach. Ethics Law 237, Law 238, Law 317, or Law 539 is a pre- or co-requisite for this clinic. Evidence, Administrative Law, U.S. Immigration and Nationality Law (Law 351), and Race and Immigration Policy (Law 768) may be helpful but are not required.",,4,CLN,E,Law School,In Person,Duke University,Durham,Regular Academic Session,01/09/2025,04/17/2025,Open,10,8,2,0,4,Graded,N,Charles Shane Ellison; Katherine L Evans
2938,LAW,445A,02,Advanced Immigrant Rights Clinic,Continuation of Law 445 Immigrant Rights Clinic. Instructor consent required.,,2 - 4,CLN,E,Law School,In Person,Duke University,Durham,Regular Academic Session,01/09/2025,04/17/2025,Closed,3,6,0,0,0,Graded,N,Charles Shane Ellison; Katherine L Evans
2954,LAW,447,01,Criminal Defense Clinic,"The Criminal Defense Clinic will center around the direct representation of indigent clients facing prosecution for criminal charges in Durham District Court. The Criminal Defense Clinic will combine a substantive weekly seminar with weekly individual case supervision and preparation meetings, and clinical casework. Prerequisites: Law 245 Evidence and Criminal Procedure (Law 225 or Law 226). Ethics Law 237, 238, 239, 240, 317, or 539 may be taken concurrently.",,4,CLN,E,Law School,In Person,Duke University,Durham,Regular Academic Session,01/09/2025,04/17/2025,Closed,8,8,0,0,4,Graded,N,Elana Fogel; Lauren Andrea Fine
2941,LAW,460,05,Negotiation for Lawyers,This course is intended to explore the processes of negotiation and settlement in legal and other contexts. The goal of the course is to provide students with the opportunity to analyze the social process of conflict resolution in different legal contexts and to gain insight into their own negotiation styles.,,3,LEC,E,Law School,In Person,Duke University,Durham,Regular Academic Session,01/09/2025,04/17/2025,Closed,24,25,0,0,10,Graded,N,Marilyn RF Phillips
2875,LAW,460,06,Negotiation for Lawyers,This course is intended to explore the processes of negotiation and settlement in legal and other contexts. The goal of the course is to provide students with the opportunity to analyze the social process of conflict resolution in different legal contexts and to gain insight into their own negotiation styles.,,3,LEC,E,Law School,In Person,Duke University,Durham,Regular Academic Session,01/09/2025,04/17/2025,Closed,24,24,0,0,10,Graded,N,Frances Turner Mock
2876,LAW,460,07,Negotiation for Lawyers,This course is intended to explore the processes of negotiation and settlement in legal and other contexts. The goal of the course is to provide students with the opportunity to analyze the social process of conflict resolution in different legal contexts and to gain insight into their own negotiation styles.,,3,LEC,E,Law School,In Person,Duke University,Durham,Regular Academic Session,01/09/2025,04/17/2025,Closed,24,25,0,0,10,Graded,N,Casandra Thomson
2877,LAW,460,08,Negotiation for Lawyers,This course is intended to explore the processes of negotiation and settlement in legal and other contexts. The goal of the course is to provide students with the opportunity to analyze the social process of conflict resolution in different legal contexts and to gain insight into their own negotiation styles.,,3,LEC,E,Law School,In Person,Duke University,Durham,Regular Academic Session,01/09/2025,04/17/2025,Open,24,15,9,0,10,Graded,N,Frances Turner Mock
2986,LAW,470,01,Poverty Law,"Study of poverty, poverty programs, and the United States civil justice system.",,3,LEC,E,Law School,In Person,Duke University,Durham,Regular Academic Session,01/09/2025,04/17/2025,Open,30,28,2,0,10,Graded,N,-; Sara J Greene
2892,LAW,473,03,Scholarly Writing Workshop,"In a workshop led by a faculty member, students will produce an original analytic paper of substantial length (ordinarily at least 30 pages). Papers must involve significant and thorough independent research, be well-written, and provide appropriate sourcing. Participants are free to choose any topic that may be addressed seriously in an article-length piece and that may be written during one semester. Papers produced in the workshop are expected to satisfy the JD or LLM upper-level writing requirements.",,3,LAB,E,Law School,In Person,Duke University,Durham,Regular Academic Session,01/09/2025,04/17/2025,Closed,12,12,0,0,5,Graded,N,Sabrina Hsin Hua Lee
2942,LAW,473,04,Scholarly Writing Workshop,"In a workshop led by a faculty member, students will produce an original analytic paper of substantial length (ordinarily at least 30 pages). Papers must involve significant and thorough independent research, be well-written, and provide appropriate sourcing. Participants are free to choose any topic that may be addressed seriously in an article-length piece and that may be written during one semester. Papers produced in the workshop are expected to satisfy the JD or LLM upper-level writing requirements.",,3,LAB,E,Law School,In Person,Duke University,Durham,Regular Academic Session,01/09/2025,04/17/2025,Closed,12,12,0,0,5,Graded,N,Amelia A Thorn
9871,LAW,474,01,Corporate Governance and Deals Lab,This experiential course applies business law concepts and theory to the practice of corporate law.,,2,LAB,E,Law School,In Person,Duke University,Durham,Regular Academic Session,01/09/2025,04/17/2025,Open,16,15,1,0,7,Graded,N,-; Yaron Nili
