class_nbr,subject,catalog_nbr,class_section,descr,catalog_description,topic,units,component,class_type,acad_career_descr,instruction_mode_descr,campus_descr,location_descr,session_descr,start_dt,end_dt,enrl_stat_descr,class_capacity,enrollment_total,enrollment_available,wait_tot,wait_cap,grading_basis,combined_section,instructors
9488,LAW,475A,01,Law and Policy Lab: Data Governance,"This course focuses on data governance: how organizations and communities make decisions about data, code, and their missions, and the wide-ranging impact of those decisions. Students will learn about three foundational data governance models: how companies protect and manage access to data; how data is shared and reused for research purposes; and how public datasets are assembled and managed. The course will feature simulations and interactive exercises to help students apply these models and skills to real-world scenarios.",,2,LAB,E,Law School,In Person,Duke University,Durham,Regular Academic Session,01/09/2025,04/17/2025,Closed,16,16,0,0,5,Graded,Y,Keith Anthony Porcaro
2946,LAW,478,01,Commercial Real Estate Transactions and Litigation,"Introduction to core types of real estate transactions encountered by practicing attorneys with a particular focus on how certain issues and relationships common to such transactions first impact document negotiation and later often lead to disputes and litigation. The course will explore these transaction types through actual case studies to identify and reinforce key business considerations, areas of friction and disagreement, and transactional/litigation strategy.",,3,SEM,E,Law School,In Person,Duke University,Durham,Regular Academic Session,01/09/2025,04/17/2025,Closed,34,34,0,0,7,Graded,N,-; Joseph Wesley Creech
2911,LAW,480,01,Mediation Advocacy,"Mediation a required step in most state and federal courts, a preferred approach to conflict resolution in many parts of the world, and a process that every litigator will use in practice. This advanced experiential seminar will explore fundamentals of mediation theory and practice from the perspective of the mediator, the attorney, and the client through group exercises and simulated mediations. You will also develop skills that will be useful in client interviewing and counseling, fact development and legal analysis, and a variety of other contexts.",,3,SEM,E,Law School,In Person,Duke University,Durham,Regular Academic Session,01/09/2025,04/17/2025,Closed,30,30,0,0,10,Graded,N,Casandra Thomson
2878,LAW,493,02,Wrongful Convictions Clinic,"The Wrongful Convictions Clinic investigates North Carolina prisoners' claims of actual innocence and wrongful conviction. Students typically work in teams of two on one inmate's case, but all students participate in 'case rounds,' where the facts and investigative strategy of each case are analyzed by the full group. Among other things, students meet with the inmate, read and digest trial transcripts, interview witnesses, consult with experts, and prepare investigative and legal strategies. Students are required to perform a minimum of 100 hours of legal work during the semester. You must be able to attend the clinic intensive weekend to enroll in this course.",,4,CLN,E,Law School,In Person,Duke University,Durham,Regular Academic Session,01/09/2025,04/17/2025,Open,10,9,1,0,5,Graded,N,James E Coleman; Jamie T Lau
2880,LAW,494,02,Advanced Wrongful Convictions Clinic,"The Advanced Clinic builds on the lectures, training, and work of the Wrongful Convictions Clinic. Students will be assigned to Clinic cases, working more independently than Clinic students, though still under faculty supervision. Depending on the status of the case, students will interview witnesses, draft legal documents, work with experts, prepare for court, and otherwise take the steps necessary to prove the Clinic client's claim of innocence and related constitutional claims. Prerequisite: Wrongful Convictions Clinic or, in the exceptional case, permission of the instructor.",,1 - 4,CLN,E,Law School,In Person,Duke University,Durham,Regular Academic Session,01/09/2025,04/17/2025,Closed,5,6,0,0,0,Graded,N,James E Coleman; Jamie T Lau
2918,LAW,502,01,Forensics Litigation,A trial advocacy course focusing on the skills around the use of forensic evidence in the courtroom.,,1.5,SEM,E,Law School,In Person,Duke University,Durham,Regular Academic Session,01/27/2025,02/08/2025,Open,15,14,1,0,5,Graded,N,Brandon L Garrett; Martha K Philpott
2987,LAW,504,1,Critical Race Theory,"Critical race theory (CRT) challenges the substance and style of conventional legal scholarship. This course introduces CRT's core principles, explores its possibilities and limitations, examines concepts of storytelling, interest convergence theory, social construction of race, black-white paradigm, myth of model minority, intersectionality, essentialism, working identity, covering, whiteness and white privilege, colorblindness, microaggressions, and implicit bias. Students will apply these theories and frameworks to cases and topics dealing with first amendment freedoms, affirmative action, employment discrimination, criminal disparities and inequities, and more.",,2,SEM,E,Law School,In Person,Duke University,Durham,Regular Academic Session,01/09/2025,04/17/2025,Open,15,9,6,0,5,Graded,N,Trina Jones
9820,LAW,508,01,"Democracy, Markets, and the Rule of Law","This seminar will explore key issues relating to democracy, markets, and the rule of law.",,2,SEM,E,Law School,In Person,Duke University,Durham,Regular Academic Session,01/09/2025,04/17/2025,Closed,18,18,0,0,7,Graded,N,Jedediah S Purdy
9856,LAW,508W,01,"Democracy, Markets, and the Rule of Law Writing Credit","While enrolled in Law 508, Democracy, Markets and the Rule of Law, students who plan significant research projects on related topics may register for a second credit in order to satisfy the JD SRWP. LAW 508W must be added no later than 7th week of class.",,1,SEM,E,Law School,In Person,Duke University,Durham,Regular Academic Session,01/09/2025,04/17/2025,Open,18,5,13,0,7,Credit / No Credit,N,Jedediah S Purdy
9870,LAW,509,01,Police Accountability,"This seminar focuses on lawyers working in the criminal justice system and law enforcement. Recommended prerequisite: not for students who took Law 611.59, Readings in Police Accountability.",,2,SEM,E,Law School,In Person,Duke University,Durham,Regular Academic Session,01/09/2025,04/16/2025,Open,14,8,6,0,7,Graded,N,Geovany E Martinez
9489,LAW,518,01,Constitutional Law II: Historical Cases & Contemporary Controversies,"This course looks at contemporary constitutional issues, such as freedom of speech and religion, unenumerated rights, and federalism, through the lens provided by cases and controversies in the first century of the U.S. Constitution's existence in order to develop a deeper understanding of the constitutional past and to acquire fresh perspectives on contemporary law.",,2,SEM,E,Law School,In Person,Duke University,Durham,Regular Academic Session,01/09/2025,04/17/2025,Open,14,12,2,0,7,Graded,N,Jeff Powell
2919,LAW,519,03,Contract Drafting,"Contract Drafting is an upper-level clinical course that teaches basic practical skills in contract drafting through written drafting exercises. The exercise will be done both in and outside of class, and extensive peer and instructor editing will be used draft in practice. The course will be a combination of lecture and in-class drafting and editing exercises, with an emphasis on the exercises. Not open to students who have taken Law 522.",,2,SEM,E,Law School,In Person,Duke University,Durham,Regular Academic Session,01/09/2025,04/17/2025,Closed,14,14,0,0,7,Graded,N,Sarah Carrington Walker
2920,LAW,519,04,Contract Drafting,"Contract Drafting is an upper-level clinical course that teaches basic practical skills in contract drafting through written drafting exercises. The exercise will be done both in and outside of class, and extensive peer and instructor editing will be used draft in practice. The course will be a combination of lecture and in-class drafting and editing exercises, with an emphasis on the exercises. Not open to students who have taken Law 522.",,2,SEM,E,Law School,In Person,Duke University,Durham,Regular Academic Session,01/09/2025,04/17/2025,Closed,14,14,0,0,7,Graded,N,Lily Sara Farel
2961,LAW,519,05,Contract Drafting,"Contract Drafting is an upper-level clinical course that teaches basic practical skills in contract drafting through written drafting exercises. The exercise will be done both in and outside of class, and extensive peer and instructor editing will be used draft in practice. The course will be a combination of lecture and in-class drafting and editing exercises, with an emphasis on the exercises. Not open to students who have taken Law 522.",,2,SEM,E,Law School,In Person,Duke University,Durham,Regular Academic Session,01/09/2025,04/17/2025,Closed,14,14,0,0,7,Graded,N,Jeremy Mullem
9586,LAW,519,06,Contract Drafting,"Contract Drafting is an upper-level clinical course that teaches basic practical skills in contract drafting through written drafting exercises. The exercise will be done both in and outside of class, and extensive peer and instructor editing will be used draft in practice. The course will be a combination of lecture and in-class drafting and editing exercises, with an emphasis on the exercises. Not open to students who have taken Law 522.",,2,SEM,E,Law School,In Person,Duke University,Durham,Regular Academic Session,01/09/2025,04/17/2025,Closed,15,16,0,0,7,Graded,N,Sarah M. Powell
9587,LAW,519,07,Contract Drafting,"Contract Drafting is an upper-level clinical course that teaches basic practical skills in contract drafting through written drafting exercises. The exercise will be done both in and outside of class, and extensive peer and instructor editing will be used draft in practice. The course will be a combination of lecture and in-class drafting and editing exercises, with an emphasis on the exercises. Not open to students who have taken Law 522.",,2,SEM,E,Law School,In Person,Duke University,Durham,Regular Academic Session,01/09/2025,04/17/2025,Closed,15,15,0,0,7,Graded,N,Sarah M. Powell
9843,LAW,521,01,International Investment Law: The Protection and Financialization of Foreign Investments,This course explores how these stakeholders derive financial value from international investment law.,,2,LEC,E,Law School,In Person,Duke University,Durham,Regular Academic Session,01/09/2025,02/27/2025,Open,37,28,9,0,10,Graded,N,Isabella Bellera; Tim Meyer
9844,LAW,521W,01,"International Investment Law:The Protection &Financialization of Foreign Investments, Writing Credit","While enrolled in Law 521 International Investment Law: The Protection and Financialization of Foreign Investments, students who plan significant research projects on related topics may register for a third credit in order to satisfy the JD Writing Requirement. LAW 521W must be added no later than 7th week of class.",,1,SEM,E,Law School,In Person,Duke University,Durham,Regular Academic Session,01/09/2025,02/27/2025,Closed,10,11,0,0,3,Credit / No Credit,N,Isabella Bellera; Tim Meyer
9818,LAW,522,01,Parental Rights and Responsibilities,This is a small discussion course focused on Supreme Court decisions relating to parental rights and responsibilities.,,2,SEM,E,Law School,In Person,Duke University,Durham,Regular Academic Session,01/09/2025,04/17/2025,Open,14,13,1,0,7,Graded,N,Doriane L Coleman
2962,LAW,530,01,Entertainment Law,"An introduction to selected theories, statutes, and regulations (other than intellectual property law) governing principal undertakings, business transactions, and legal relationships in the entertainment industry, including publishing, the theater, television and motion pictures, music, and related fields.",,3,SEM,E,Law School,In Person,Duke University,Durham,Regular Academic Session,01/09/2025,04/17/2025,Open,25,15,10,0,10,Graded,N,-; Jennifer T Anderson
2895,LAW,531,01,In-House Law Practice,"This course explores the substantive and procedural aspects of in-house law practice, and how they differ from law firm and governmental practices. The class sessions will present substantive legal topics discussed with legal practitioners. Course materials will be drawn from statutory, regulatory, and policy-driven materials, as well as case studies. Students will have team-based interdisciplinary project assignments that will draw from topics discussed in the class, reflecting real-world scenarios.",,2,SEM,E,Law School,In Person,Duke University,Durham,Regular Academic Session,01/09/2025,04/17/2025,Open,25,22,3,0,7,Graded,N,Allen William Nelson; Bradley Zimmer
2861,LAW,532,01,Venture Capital Financing,"This class will focus on the legal and economic structure of capital transactions and will familiarize students with the legal agreements used to document these transactions. Using lectures and in-class exercises, students will learn the function of the most common transaction documents, the economic and/or legal purpose of the provisions contained within these documents and alternative approaches to address specific situations. Students will work on a simulated transaction to gain experience in negotiating and drafting documents with an emphasis on meeting client objectives. Students will be evaluated on class participation, written assignments and potentially, a final exam. Prerequisite: Law 210.",,3,SEM,E,Law School,In Person,Duke University,Durham,Regular Academic Session,01/09/2025,04/17/2025,Open,20,17,3,0,10,Graded,N,W H Johnson
2998,LAW,535,01,Corporations and American Democracy,"This seminar, at the intersection of corporate and constitutional law, will explore the role of the corporation in American democracy from a public and private law perspective, examining the rights and responsibilities of corporations in social and political activity and whether the government can or should regulate them.",,2,SEM,E,Law School,In Person,Duke University,Durham,Regular Academic Session,01/09/2025,04/17/2025,Open,14,11,3,0,7,Graded,N,Ashlee Anne Paxton-Turner
9490,LAW,545,01,Urban Legal History,"Urban Legal History is a research seminar which will focus on the legal issues relating to Durham's political, social, and economic development. The class will involve intensive study of primary and secondary materials, and will require students to produce substantial (45 page) research papers.",,3,SEM,E,Law School,In Person,Duke University,Durham,Regular Academic Session,01/09/2025,04/17/2025,Closed,14,14,0,0,7,Graded,N,Joseph Blocher
2891,LAW,546,01,International Law of Armed Conflict,"This seminar will examine the international law of armed conflict, and it focuses on the jus in bello context. Students will examine the key concepts of the law of armed conflict, and explore their practical application in various contexts. Case studies will be examined in conjunction with the topics covered. The historical context for law of armed conflict agreements, the status of conflicts, combatants, and civilians, targeting, rules of engagement, and war crimes, are included among the topics the class will address. Students will be encouraged to relate legal and interdisciplinary sources in order to better understand the multi-faceted interaction between law and war.",,3,SEM,E,Law School,In Person,Duke University,Durham,Regular Academic Session,01/09/2025,04/17/2025,Open,30,18,12,0,10,Graded,N,Charles J Dunlap
2882,LAW,549,01,Corporate Counseling and Communication,"The practice of law primarily involves understanding and resolving clients' legal issues. While doctrinal courses teach the fundamental legal principles lawyers need to know, this course focuses on how lawyers use that knowledge to assess legal issues and advise clients. The primary objective is to simulate the practice of law, particularly as a young associate would likely experience it, whether in a large law firm or a small office. The curriculum focuses on two areas: 1) identifying the legal issues rising from a fact pattern; and 2) client communication. Students will track their 'billable hours', teaching them to be efficient and cognizant of the time they spend on each issue.",,2,SEM,E,Law School,In Person,Duke University,Durham,Regular Academic Session,01/09/2025,04/17/2025,Closed,20,20,0,0,7,Graded,N,Marie G Lukens
2881,LAW,561,01,Tax Policy,"This course will begin with a background discussion of the public finance economics underlying taxation, and then proceed to an examination of the major tax types, analyzing each in terms of its efficiency, fairness, and administrability.",,2,SEM,E,Law School,In Person,Duke University,Durham,Regular Academic Session,01/09/2025,04/17/2025,Open,15,11,4,0,5,Graded,N,Lawrence Zelenak
2967,LAW,570,01,Criminology and Criminal Procedure,"In this seminar, we will read social science research to examine the empirical assumptions of rules, systems, and practices of criminal law and procedure. We will cover a series of empirical questions, which may include: (1) Does stop and frisk policing reduce crime? (2) Can body cameras change police behavior? (3) Does the death penalty deter? (4) Are there alternatives to incarceration that can keep us safe? (5) Is there racial disparity in sentencing, and if there is, what can we do about it? (6) What is the right age of majority to separate the juvenile and adult justice systems?",,2,SEM,E,Law School,In Person,Duke University,Durham,Regular Academic Session,01/09/2025,04/17/2025,Open,15,5,10,0,7,Graded,N,-; Ben Grunwald
9822,LAW,574,01,Lying and Law of Questioning,"This seminar addresses how legal institutions define and detect dishonesty. Topics include 'post-truth' discourse and suspension of fact-finding and truth-seeking; the 'law of questioning' that governs legal truth-seeking in investigations and trials, with particular focus on the criminal justice process (interrogation practices, the problem of false confessions, liability for dishonest statements, cross examination, character and credibility, and lie detection in the laboratory, courtroom, and popular culture). Readings include excerpts from law review articles and scholarly books, works of social science, investigative reporting, documentary footage, editorial commentary, and popular culture.",,1,SEM,E,Law School,In Person,Duke University,Durham,Regular Academic Session,01/09/2025,04/17/2025,Open,16,11,5,0,0,Graded,N,-; Lisa K Griffin
9823,LAW,574W,01,"Lying and The Law of Questioning, Writing Credit","While enrolled in Law 574 Lying and the Law of Questioning, students who plan significant research projects on related topics may register for a second credit in order to satisfy the JD Writing Requirement. *LAW 574W must be added no later than 7th week of class.*",,1,SEM,E,Law School,In Person,Duke University,Durham,Regular Academic Session,01/09/2025,04/17/2025,Open,16,3,13,0,0,Graded,N,Lisa K Griffin
2897,LAW,577,01,Emerging Issues in Sports Law,"Examination of current issues in Sports Law through interactions with industry professionals. The course will bring to campus legal and business leaders on the front lines of dealing with a particular issue, in a colloquium setting that allows students to discuss the topics directly with the guests. Class topics will vary from year to year based on timeliness and industry developments.",,2,SEM,E,Law School,In Person,Duke University,Durham,Regular Academic Session,01/09/2025,04/17/2025,Closed,15,15,0,0,5,Graded,N,Paul H Haagen
9819,LAW,580,01,Law and Social Science Colloquium,This research seminar will involve discussing some of the latest research at the intersection of the fields of law and social science.,,2,SEM,E,Law School,In Person,Duke University,Durham,Regular Academic Session,01/09/2025,04/17/2025,Open,14,9,5,0,7,Graded,N,-; Brandon L Garrett; Christopher Buccafusco
3023,LAW,586,01,Current Debates in Bankruptcy Law,"This seminar will examine selected topics in bankruptcy law, including whether it is simply a procedural remedy for enforcing substantive rights parties have outside bankruptcy or an opportunity more fairly to redistribute assets (or losses) among stakeholders? Should be Bankruptcy Code be read like any other statute, or do we need special principles for bankruptcy law, and broad equitable powers for bankruptcy courts, to encourage businesses and consumers to reorganize? Should bankruptcy be allowed to more thoroughly shield consumers from collection efforts, or do we prioritize creditors' efforts to get paid?",,2,SEM,E,Law School,In Person,Duke University,Durham,Regular Academic Session,01/09/2025,04/17/2025,Closed,12,12,0,0,5,Graded,N,Jonathan Mark Seymour
3007,LAW,593,01,Sexuality and the Law,"Issues in the legal regulation of human sexuality and gender identity are contested to varying degrees worldwide. Taking a global, comparative, and interdisciplinary approach to the investigation of the legal regulation of human sexuality and gender identity, this course uses case-studies to examine the cultural and religious, as well as the political and jurisprudential foundations of court decisions, laws, and regulations.",,2,SEM,E,Law School,In Person,Duke University,Durham,Regular Academic Session,01/09/2025,04/17/2025,Open,14,10,4,0,7,Graded,N,Juliette Duara
9491,LAW,599,01,"Race, Bioethics and the Law","The course will cover historical bioethical incidents that shaped racially marginalized individuals' relationships with healthcare and science. It will also examine healthcare, bioethics, and the law through the lens of racially marginalized peoples and anti-Blackness in law and policy. Lastly, it will also cover various approaches to integrating anti-racist principles into the practice of law.",,2,SEM,E,Law School,In Person,Duke University,Durham,Regular Academic Session,01/09/2025,04/17/2025,Closed,10,10,0,0,10,Graded,Y,Nia M Johnson
2970,LAW,604,03,Ad Hoc Tutorial,A group of five or more upper-level students may organize and lead a one- to two-credit ad hoc seminar on diverse topics under the supervision of a faculty member.,Film and the Law,2,TUT,E,Law School,In Person,Duke University,Durham,Regular Academic Session,01/09/2025,04/17/2025,Closed,7,7,0,0,0,Credit / No Credit,N,Emilie Kathleen Aguirre
2971,LAW,604,04,Ad Hoc Tutorial,A group of five or more upper-level students may organize and lead a one- to two-credit ad hoc seminar on diverse topics under the supervision of a faculty member.,Advanced Mediation,2,TUT,E,Law School,In Person,Duke University,Durham,Regular Academic Session,01/09/2025,04/17/2025,Closed,8,8,0,0,0,Credit / No Credit,N,Casandra Thomson
2972,LAW,604,05,Ad Hoc Tutorial,A group of five or more upper-level students may organize and lead a one- to two-credit ad hoc seminar on diverse topics under the supervision of a faculty member.,Procedural Due Process,1,TUT,E,Law School,In Person,Duke University,Durham,Regular Academic Session,01/09/2025,04/17/2025,Open,10,9,1,0,0,Credit / No Credit,N,Brandon L Garrett
10297,LAW,604,06,Ad Hoc Tutorial,A group of five or more upper-level students may organize and lead a one- to two-credit ad hoc seminar on diverse topics under the supervision of a faculty member.,Wine and the Law,1,TUT,E,Law School,In Person,Duke University,Durham,Regular Academic Session,01/09/2025,04/17/2025,Closed,5,5,0,0,0,Credit / No Credit,N,Christopher Buccafusco
10475,LAW,604,07,Ad Hoc Tutorial,A group of five or more upper-level students may organize and lead a one- to two-credit ad hoc seminar on diverse topics under the supervision of a faculty member.,OJ Simpson,1,TUT,E,Law School,In Person,Duke University,Durham,Regular Academic Session,01/09/2025,04/17/2025,Closed,10,10,0,0,0,Credit / No Credit,N,James E Coleman
2953,LAW,611,47,Readings,"This discussion course focuses on readings that explore connections between the law, the practice of law, the legal system and issues of current societal importance or interest. Each section of the course is expected to have a different specific focus and different readings. This course is assessed on a credit/no credit basis.",Topics in Corp. Diversity,1,DIS,E,Law School,In Person,Duke University,Durham,Regular Academic Session,02/28/2025,03/01/2025,Closed,16,16,0,0,7,Credit / No Credit,N,Darren Rosenblum
3016,LAW,611,54,Readings,"This discussion course focuses on readings that explore connections between the law, the practice of law, the legal system and issues of current societal importance or interest. Each section of the course is expected to have a different specific focus and different readings. This course is assessed on a credit/no credit basis.",Law and Algorithms,1,DIS,E,Law School,In Person,Duke University,Durham,Regular Academic Session,01/09/2025,04/17/2025,Open,27,26,1,0,5,Credit / No Credit,N,Keith Anthony Porcaro
3029,LAW,611,58,Readings,"This discussion course focuses on readings that explore connections between the law, the practice of law, the legal system and issues of current societal importance or interest. Each section of the course is expected to have a different specific focus and different readings. This course is assessed on a credit/no credit basis.",Race & Legal Profession,1,DIS,E,Law School,In Person,Duke University,Durham,Regular Academic Session,01/09/2025,02/20/2025,Open,10,8,2,0,5,Credit / No Credit,N,Geovany E Martinez
9551,LAW,611,60,Readings,"This discussion course focuses on readings that explore connections between the law, the practice of law, the legal system and issues of current societal importance or interest. Each section of the course is expected to have a different specific focus and different readings. This course is assessed on a credit/no credit basis.",Curr. Iss. in Law & Religion,1,DIS,E,Law School,In Person,Duke University,Durham,Regular Academic Session,01/20/2025,03/24/2025,Closed,15,15,0,0,7,Credit / No Credit,N,Richard B Katskee
