class_nbr,subject,catalog_nbr,class_section,descr,catalog_description,topic,units,component,class_type,acad_career_descr,instruction_mode_descr,campus_descr,location_descr,session_descr,start_dt,end_dt,enrl_stat_descr,class_capacity,enrollment_total,enrollment_available,wait_tot,wait_cap,grading_basis,combined_section,instructors
3090,HISTORY,103,01,Critical Approaches to Global Issues,"Introduction to critical transnational studies through several disciplinary approaches. Examines capitalism and neo-liberal globalization and their relationships to culture, politics, economics, and other social forms and outcomes; considers transnationalism 'from below'; addresses linear and Western-centric thinking about progress and modernity; focuses a historical lens on political discourses, institutions, and projects to understand them contextually; demonstrates how cultures and identities are dynamically constituted in interaction with historical, material, political, and situational factors; considers how different inequalities and contestations inflect most social formations.",,1,LEC,E,Undergraduate,In Person,Duke University,Durham,Regular Academic Session,08/25/2025,12/05/2025,Open,50,35,15,0,50,Graded,Y,Adam Richard Rosenblatt; Cade Bourne; Summer Steenberg
7026,HISTORY,122,01,History of Latinxs in the United States,"This introductory course will cover the social, cultural, and political histories of Latino/as in the United States from 1848 to the present including the Treaty of Guadalupe Hidalgo, the Great Depression, WWI/WWII, the creation of Latino/a civil rights organizations, and the civil wars and free trade agreements of the 1980s and 1990s that have spurned so much of contemporary migration. Themes include colonialism and conquest, sexuality and gender, race and ethnicity, transnationalism and migration, social inequality and practices of resistance. This class will highlight the diversity of the Latino/a experience—focusing on the history of Afro-Latino/as, queer Latino/as, and undocumented Latino/as.",,1,LEC,E,Undergraduate,In Person,Duke University,Durham,Regular Academic Session,08/25/2025,12/05/2025,Open,30,8,22,0,30,Graded,Y,Cecilia Marquez
7031,HISTORY,124,01,History of the Present,"Examines the history of the past forty years, focusing on the United States in a global context. Themes might include: globalization, inequality, the rise of the alt-right, climate change, the internet, and the emergence of finance and consulting. Prepares students to think historically about their own world, and gives them the opportunity to use historical methods to think about the forces shaping their lives, their families, and their potential careers. Draws on a wide variety of sources and genres: alongside more traditional academic readings, students might be exposed to digital storytelling, journalism, television, and video games.",,1,LEC,E,Undergraduate,In Person,Duke University,Durham,Regular Academic Session,08/25/2025,12/05/2025,Closed,108,109,0,0,108,Graded,Y,James G Chappel; -; -
3102,HISTORY,125S,01,The Documentary Experience: A Video Approach,"A documentary approach to the study of local communities through video production projects assigned by the course instructor. Working closely with these groups, students explore issues or topics of concern to the community. Students complete an edited video as their final project.",,1,SEM,E,Undergraduate,In Person,Duke University,Durham,Regular Academic Session,08/25/2025,12/05/2025,Open,14,13,1,0,14,Graded,Y,GARY Hawkins
3117,HISTORY,126S,01,Introduction to Oral History,"Introductory oral history fieldwork seminar. Oral history theory and methodology, including debates within the discipline. Components and problems of oral history interviewing as well as different kinds of oral history writing.",,1,SEM,E,Undergraduate,In Person,Duke University,Durham,Regular Academic Session,08/25/2025,12/05/2025,Closed,15,18,0,0,15,Graded,Y,Michelle Lanier
3953,HISTORY,129,01,Introduction to African Studies (DS3 or DS4),"A range of disciplinary perspectives on key topics in contemporary African Studies: nationalism and pan-Africanism, imperialism and colonialism, genocide and famine, development and democratization, art and music, age and gender.",,1,LEC,E,Undergraduate,In Person,Duke University,Durham,Regular Academic Session,08/25/2025,12/05/2025,Open,60,19,41,0,60,Graded,Y,Khwezi Mkhize
7038,HISTORY,138,01,From Stalin to Putin: The Art of Dictatorship,"When the Soviet Union ceased to exist, many believed that Russia's history of autocratic rule might finally end. Today Russia under Putin appears to be retreating from democracy. Putin's rule is routinely compared to a dictatorship. The Soviet most notorious dictator, Stalin is being rehabilitated by the Russian establishment. This course traces the history of modern Russian politics from Stalin to Putin and examines how such completely ordinary individuals managed to amass the kind of power that is best described dictatorial. It examines the complex evolution of communist and post-Soviet leadership. The course is comparative and draws on Nazi Germany and Fascist Italy as case studies.",,1,LEC,E,Undergraduate,In Person,Duke University,Durham,Regular Academic Session,08/25/2025,12/05/2025,Open,25,9,16,0,25,Graded,Y,Anna Krylova
10431,HISTORY,144CNS,01,Photography and History: Dictatorship & Resistance in Latin America,"This seminar explores the power of photographic images as 20th century Latin America suffered from and resisted dictatorships and fought for democracy. It opens with the world's first fully photographed and filmed revolution in Mexico (1910-17), and then investigates photographic practice in Cuba, Chile, & Brazil after 1945. While used as a tool of oppression, photographic images will also be explored as vital weapons against human rights violations and fuel for popular democratic insurgencies. This course offers freshmen a chance to share the excitement of research in action, on learning with rather than teaching at, as they improve their skill in 'reading' and contextualizing images while debating what truths, if any, a photographer can communicate, how, and under what circumstances?",,1,SEM,E,Undergraduate,In Person,Duke University,Durham,Regular Academic Session,08/25/2025,12/05/2025,Open,18,7,11,0,18,Graded,N,John D French
10432,HISTORY,145CNS,01,Indigenous Storytelling and Histories of Place,"More than antiquated stories confined to the archival record, Indigenous storytelling provides living communities today with avenues to communicate directly with ancestors to co-create abundant futures. Expressed through genealogical relationships to lands, waters, and peoples, Native communities cultivate abundance through providing care and mutual aid to each other and their environments. The course provides a framework for observing abundance created by historical and present Indigenous communities through engaged readings of critical texts and embodied practices of storytelling through art. By rejecting models of scarcity and loss of knowledge and power projected by five centuries of colonization, students will build a practical toolkit for creating abundance in everyday life.",,1,SEM,E,Undergraduate,In Person,Duke University,Durham,Regular Academic Session,08/25/2025,12/05/2025,Open,15,10,5,0,15,Graded,N,Alika M Bourgette
7043,HISTORY,147,01,Global History of the Prison,"This is an introductory lecture class on the global history of incarceration. It studies the emergence of the prison as a penal institution in various forms: the medieval debtors' prison, industrial poorhouses, colonial prison and detention camps, and the modern prison industrial complex. Special focus is dedicated to the relationship between incarceration and race in a global context. Over the course of the semester, students will work on multimedia projects on a special topic related to prison history.",,1,LEC,E,Undergraduate,In Person,Duke University,Durham,Regular Academic Session,08/25/2025,12/05/2025,Open,75,54,21,0,75,Graded,Y,Sarah M Balakrishnan
8801,HISTORY,152CNS,01,"Visualizing Minor Stories: Archives, Museums, Histories","Explores local/ global archives to document distant, marginal or invisible histories. Guided research in Duke's collections and other museums, galleries, and digital collections. Examines injustice, liberation, and empowerment through knowledge production. Trace historical divisions and produce related research and creative projects. Variable topics like travel and missionary writings; wartime and military records of American wars in Asia and the Middle East; Afro-Asian solidarity; global and American civil rights; imperialism and the global cold war, global diasporas including Asian/American and other minority movements. Explore variable forms: oral histories, film and photography, digital exhibitions, and creative works.",,1,SEM,E,Undergraduate,In Person,Duke University,Durham,Regular Academic Session,08/25/2025,12/05/2025,Open,18,13,5,0,18,Graded,Y,Aimee Kwon
7005,HISTORY,157S,01,Gateway Seminar: Empires in Historical Perspective,"Study of modern empires in historical comparative-connective perspective. Approaches, methods, themes include social history from below, maritime history, history of technology, debates about the ethicality of war, occupation and regime change in sovereign territories. Final research paper involving intensive primary-source research, extensive use of secondary and on-line sources for the study of empires.",,1,SEM,E,Undergraduate,In Person,Duke University,Durham,Regular Academic Session,08/25/2025,12/05/2025,Open,18,7,11,0,18,Graded,Y,Avrati Bhatnagar
5620,HISTORY,170FS,01,Beyond Denial - A Thriving Future,"Part of the Focus cluster 'It's Not Too Late to Build a Better World,' requires permission. What are the roots of the climate crisis or unparalleled inequality? This course explores big ideas as well as specific models that envision a radically different future, one that provides for the common good within our given biophysical limits, including discourses such as post-growth, wellbeing, and care economics; eco-feminism; eco-anarchism; decolonization; ecological justice; and commoning. A reading and discussion intensive course that uses an interdisciplinary approach and includes elements of research, individual and group presentations, as well as a writing requirement.",,1,SEM,E,Undergraduate,In Person,Duke University,Durham,Regular Academic Session,08/25/2025,12/05/2025,Open,18,17,1,0,18,Graded,Y,Dirk Philipsen
6967,HISTORY,178FS,01,History of Energy Use and Power Generation,"The use of energy throughout human history is explored, starting from the beginnings of humanity to modern power generation. This course will consider the development of different energy sources over time, the history of energy conversion and storage technologies, and the establishment of modern thermal sciences. A major focus is the investigation of how these developments affected societal, economic, military, and technological change and growth. Understanding the historical trends related to energy use and power generation will allow for better informed prediction of humanity's energy future. Open only to students in the Focus program.",,1,SEM,E,Undergraduate,In Person,Duke University,Durham,Regular Academic Session,08/25/2025,12/05/2025,Open,18,16,2,0,18,Graded,Y,Tom J. Cinq-Mars
7057,HISTORY,181CNS,01,"Sex, Bodies, and Power","In our world, bodies and sexual acts have become linked to political power in terms of pleasure, reproduction, identity, and even basic bodily functions such as urination and defecation. How has something so basic as one's body become so closely associated with power? Sex, Bodies, and Power engages in an interdisciplinary examination of written and visual texts to examine the way bodies have been linked to sex and power. How do we understand our own bodies? How do we develop sexual fantasies, and how are those fantasies regulated by the state and other actors and institutions? Do bodies and sex become regulated differently depending on race, ethnicity, nationality, and gender? How does this change in different times and places? How is all of this altered by global pandemics, anti-racist movements, reproductive justice, and queer embodiment? What does it mean to engage in a historical analysis of these questions?",,1,SEM,E,Undergraduate,In Person,Duke University,Durham,Regular Academic Session,08/25/2025,12/05/2025,Open,15,11,4,0,15,Graded,Y,Peter Sigal
7042,HISTORY,189S,01,Gateway Seminar: Slavery and Its Afterlives,"Examines the history of American slavery and the legacies of slavery in the present. Focus on slavery as a system of labor, law, race, kinship, knowledge, space, culture, property, and reproduction that affected all areas of American development. Considers the role of slavery in political debates about reparations, Confederate monuments, and critical race theory.",,1,SEM,E,Undergraduate,In Person,Duke University,Durham,Regular Academic Session,08/25/2025,12/05/2025,Open,18,10,8,0,18,Graded,Y,Justin C Leroy
6996,HISTORY,190FS,01,Topics in Focus Program,Open only to students in the Focus Program. Current list of courses available in the Focus program brochure and online.,RENAISSANCE PROFESSIONALS,1,SEM,E,Undergraduate,In Person,Duke University,Durham,Regular Academic Session,08/25/2025,12/05/2025,Open,18,13,5,0,18,Graded,Y,Thomas Robisheaux
6997,HISTORY,190FS,02,Topics in Focus Program,Open only to students in the Focus Program. Current list of courses available in the Focus program brochure and online.,GREAT ABRAHAMIC BOOKS,1,SEM,E,Undergraduate,In Person,Duke University,Durham,Regular Academic Session,08/25/2025,12/05/2025,Open,18,16,2,0,18,Graded,N,Peter J Casarella
6998,HISTORY,190FS,03,Topics in Focus Program,Open only to students in the Focus Program. Current list of courses available in the Focus program brochure and online.,HISTORY OF ABORTION,1,SEM,E,Undergraduate,In Person,Duke University,Durham,Regular Academic Session,08/25/2025,12/05/2025,Open,18,17,1,0,18,Graded,N,Jenny Wood Crowley
6999,HISTORY,190FS,04,Topics in Focus Program,Open only to students in the Focus Program. Current list of courses available in the Focus program brochure and online.,FREE TO THINK,1,SEM,E,Undergraduate,In Person,Duke University,Durham,Regular Academic Session,08/25/2025,12/05/2025,Closed,18,18,0,0,18,Graded,N,Alfredo W Watkins; Polly Ha
9671,HISTORY,195FS,01,Introduction to Jewish Studies,"Why and how do we study Jewish religion, history, culture, philosophy, and politics? Introduction to the Jewish scholarly world over three millennia with an emphasis on modern approaches and contemporary problems. Includes ancient texts, medieval philosophy, modern Jewish literature and film, Sephardi/Mizrahi traditions, responses to the Holocaust, American Jewish culture, Israel/Palestine, etc. Several Duke professors and other experts (rabbis, curators, community leaders) lead guest sessions. Includes at least one field trip to a local museum, cultural site, or organization. Part of the Focus cluster Science & Religion in Public Life.",,1,SEM,E,Undergraduate,In Person,Duke University,Durham,Regular Academic Session,08/25/2025,12/05/2025,Open,18,14,4,0,18,Graded,Y,Aslan Cohen mizrahi
8191,HISTORY,196S,01,"Imagining Human Rights: Science Fiction, Culture, and the Creation of Rights","This course engages students in the intersection of speculative fiction and the history of ideas about human rights and what it means to be human. Using interdisciplinary tools, including history, anthropology, and public policy, students will explore created worlds and new ways of thinking about what rights humans—and other beings—have, how those rights are proposed, and what happens when those rights are contested. The course focuses on how the imaginary influences or presages the real, allowing us to experiment with what-ifs. Students will work in Duke's Locus Archives of primary documents on 20th-century science fiction spanning writers from China, the USSR., and Japan.",,1,SEM,E,Undergraduate,In Person,Duke University,Durham,Regular Academic Session,08/25/2025,12/05/2025,Closed,18,18,0,0,18,Graded,Y,Robin Kirk
7040,HISTORY,198,01,Introduction to Asian American History,"An introduction to the historical experiences of the diverse communities of Asian America, from the mid-19th century to the early 21st century. Topics will include migration, immigration law, experiences of war, community formation, and political activism. Students will also gain experience working with primary sources.",,1,LEC,E,Undergraduate,In Person,Duke University,Durham,Regular Academic Session,08/25/2025,12/05/2025,Open,13,6,7,0,13,Graded,Y,Susan B Thananopavarn
9093,HISTORY,204S,01,Histories of the Future: Hope in the Past and Present,"This class, offered in the Transformative Ideas Program, explores the ways in which people have imagined the future from Antiquity to the present. We begin with a study of the prophetic traditions in Judaism, Christianity, and Islam and the spread of apocalyptic ideas in medieval and Renaissance Europe. Then, we turn to the emergence of the Idea of Progress in the Enlightenment and beyond before tracing the interplay of apocalypticism and progressivism down to the contemporary period. Historically these visions of the future – one religious and one predominantly secular – have played a major role in shaping the human capacity for hope. But what can we do at present? Neither narrative exercises the hold it once did. Where – in a moment of global crises – do we turn for hope? x",,1,SEM,E,Undergraduate,In Person,Duke University,Durham,Regular Academic Session,08/25/2025,12/05/2025,Open,15,11,4,0,15,Graded,Y,John J. Martin
5628,HISTORY,206,01,"Great Powers Diplomacy, 1789-1914","This course will examine the political, economic, diplomatic and military relations of the Great Powers, 1789-1914. We will trace the development of the Great Power system within the context of the foundations of State power, examining topics including: (1) the diplomacy of the individual Great Powers; (2) the rise of non-European powers; (3) the military strategies of the Great Powers in peacetime and war; (4) the relationship between European continental commitments and world power; (5) the significance of technological advance for the strategic balance; (6) and the relationship between economic stability and diplomacy in the international system. We will end by exploring the collapse of the 19th century international system and the origins and outbreak of World War I.",,1,LEC,E,Undergraduate,In Person,Duke University,Durham,Regular Academic Session,08/25/2025,12/05/2025,Open,20,17,3,0,20,Graded,Y,Jennifer L Siegel; -
6496,HISTORY,212,01,The Turks: From Ottoman Empire to European Union,"Readings in cultural history and literature to examine transformations in Turkish identity from the Ottoman era to EU accession. Discussion of the 'gazi thesis', the 'sultanate of women', religious tolerance (millets), conversion, modernity and nationalism. Secondary topics include Sufism, Islam, gender, and historiography. Interdisciplinary focus. Taught in English.",,1,LEC,E,Undergraduate,In Person,Duke University,Durham,Regular Academic Session,08/25/2025,12/05/2025,Open,18,9,9,0,18,Graded,Y,Erdag M Goknar
6983,HISTORY,214,01,The Modern Middle East,The historical development of the Middle East in the nineteenth and twentieth centuries. The emergence of nation-states in the region following World War I.,,1,LEC,E,Undergraduate,In Person,Duke University,Durham,Regular Academic Session,08/25/2025,12/05/2025,Open,48,14,34,0,48,Graded,Y,Abram Wilson Smith
4112,HISTORY,216S,01,"Between Moscow, Beijing and Delhi: Narratives of Europe and Asia","Exercise in reconstructing Eurasian history from the 13th century Mongol invasions to post-Soviet era through critical reading of eyewitness accounts—travel notes and memoirs. Reflects on political, religious, and cultural evolution, expansion, and rivalry as well as cross-cultural and trans-regional exchange.",,1,SEM,E,Undergraduate,In Person,Duke University,Durham,Regular Academic Session,08/25/2025,12/05/2025,Open,12,9,3,0,12,Graded,Y,Mustafa O Tuna
7009,HISTORY,219S,01,Indian Civilization,"Surveys the rise of civilization and kingdoms on the Indian subcontinent from the first urban centers of the Indus Valley through the establishment of the Mughal Empire in the 16th century. Uses literary, archeological, linguistic, ethnological, and inscriptional evidence on the diversity of Indic peoples and their complex social, religious, and caste integration into the major states and empires of pre-modern India; considers wider civilizational networks and extensions of the Indian cultural sphere into other parts of Asia; integrates a historical and anthropological perspective on various primary materials.",,1,SEM,E,Undergraduate,In Person,Duke University,Durham,Regular Academic Session,08/25/2025,12/05/2025,Open,18,13,5,0,18,Graded,Y,John R Freeman
6981,HISTORY,226,01,Ancient and Early Modern Japan,"Japan from earliest settlement to 1868; the Heian Court, rise of the samurai, feudal society and culture, the Tokugawa age, and the Meiji Restoration.",,1,LEC,E,Undergraduate,In Person,Duke University,Durham,Regular Academic Session,08/25/2025,12/05/2025,Open,25,10,15,0,25,Graded,Y,Simon C Partner
3384,HISTORY,230,01,Greek History,"The political and intellectual history of the Greeks from earliest times to the death of Alexander the Great. Not open to students who have had, or are taking, Classical Studies 181S.",,1,LEC,E,Undergraduate,In Person,Duke University,Durham,Regular Academic Session,08/25/2025,12/05/2025,Open,35,25,10,0,35,Graded,Y,Joshua D Sosin; Brooke Elizabeth Braden
3399,HISTORY,231,01,Ancient Athletics,"The athletic festivals of the ancient Greeks and Romans are among the most enduring legacies of the Classical world, and provide a particularly accessible introduction to the study of antiquity. Through examination of literary and historiographical sources (in translation) and of the material remains at the ancient sites, this course introduces students to the origins and development of the major athletic contests (especially the Olympic Games), the methods and practicalities of ancient training, and the changing role of athletics in ancient and modern education, religion, and politics. We end with a survey of the modern Olympic movement, from the nineteenth century to the present.",,1,LEC,E,Undergraduate,In Person,Duke University,Durham,Regular Academic Session,08/25/2025,12/05/2025,Open,90,50,40,0,90,Graded,Y,Alex Karsten; Robbie Buhite
9420,HISTORY,234,01,Democracy: Ancient and Modern,"Examines democracy in its ancient and modern forms, with special attention to Athenian and American democracy. Does modern democracy fulfill the promise of ancient democracy, or betray its fundamental tenets? Topics may include freedom, equality, and rights; democratic institutions; citizenship; rhetoric; democratic knowledge and decision-making; foreign policy; corruption; religion; and hope.",,1,LEC,E,Undergraduate,In Person,Duke University,Durham,Regular Academic Session,08/25/2025,12/05/2025,Open,35,21,14,0,35,Graded,Y,Gabe E Whitbread
7033,HISTORY,235,01,"Drugs, Chemicals, and Health: Histories of Substances in Economies, Environments, and Bodies","This course asks how we might think historically about synthetic chemicals, natural alternatives, and the benefits and hazards they pose to human health, society, and environments. Combining cultural, political, and economic history with interdisciplinary environmental history and science & technology studies, we will follow historical 'biographies' and 'genealogies' of drugs and chemicals through economies, environments, and bodies, from cellular to planetary scales, comparing and connecting different global settings (including North Carolina). Focal substances may include aluminum, antiretrovirals, DDT, gold, indigo, mercury, nicotine, quinine, and opioids.",,1,LEC,E,Undergraduate,In Person,Duke University,Durham,Regular Academic Session,08/25/2025,12/05/2025,Open,100,97,3,0,100,Graded,Y,Evan Hepler-Smith
9364,HISTORY,246,01,Religion and Colonialism in Africa,"This course examines religious life in Africa across space and time with a particular focus on the impact of colonialism. We will investigate the role of colonialism in the emergence of the concepts of both 'Africa' and 'religion,' before moving to explore the continent's breadth of religious practice and thought. We will engage with a range of indigenous traditions, local Christian and Islamic practices, mission Christianity in a variety of contexts, and the movement of African religions beyond the continent. Literature will be drawn from religious studies, history, and anthropology, and will incorporate discussions on writing about Africa.",,1,LEC,E,Undergraduate,In Person,Duke University,Durham,Regular Academic Session,08/25/2025,12/05/2025,Open,30,2,28,0,30,Graded,Y,Raffaella M Taylor-Seymour
