class_nbr,subject,catalog_nbr,class_section,descr,catalog_description,topic,units,component,class_type,acad_career_descr,instruction_mode_descr,campus_descr,location_descr,session_descr,start_dt,end_dt,enrl_stat_descr,class_capacity,enrollment_total,enrollment_available,wait_tot,wait_cap,grading_basis,combined_section,instructors
9026,HISTORY,252S,01,"Unsettling Modernity: Korea, Empire, Diaspora","Korean history from the late 19th century to the present. Examines how colonialisms, cold war divisions, and transnational migrations have shaped modern Korean identities both on the Korean Peninsula and in the diaspora. Challenges dominant narratives of modernization by centering marginalized perspectives and exploring key moments in modern Korean history: Japanese colonial rule, liberation and division, the Korean War, ideologies of 'self-reliance' in North and South Korea, South Korea's role in the Vietnam War, and democracy in neoliberal South Korea. Engages transnational Korean literature, history, theory, and visual media to reassess the nation-state as a construct shaped by colonial and Cold War structures.",,1,SEM,E,Undergraduate,In Person,Duke University,Durham,Regular Academic Session,08/25/2025,12/05/2025,Open,18,6,12,0,18,Graded,Y,Sung Eun Kim
7007,HISTORY,254,01,Europe in the Middle Ages: Rome to Renaissance,"Lecture course follows the transformation of medieval politics, society and culture from the First Crusade to the Reformation. The evolution of secular monarchies and the flourishing of vernacular literature and devotion. The growth of commerce and an urban middle class. New forms of feminine religiosity and fascination with Christ's humanity. Intensified alienation and persecution of marginal groups such as the Jews. Field trip to the local museum.",,1,LEC,E,Undergraduate,In Person,Duke University,Durham,Regular Academic Session,08/25/2025,12/05/2025,Open,25,7,18,0,25,Graded,Y,Jehangir Y Malegam
2937,HISTORY,261,01,Germany Confronts Nazism and the Holocaust,"The ways in which official German culture comes to terms with its Nazi past. Background reading in history and politics; primary focus on films, dramas, novels, and poetry, as well as public memorials, monuments, and museums. Authors treated include: Wolfgang Borchert, Rolf Hochhuth, Peter Weiss, Ruth Klüger. Taught in English.",,1,LEC,E,Undergraduate,In Person,Duke University,Durham,Regular Academic Session,08/25/2025,12/05/2025,Open,30,17,13,0,30,Graded,Y,Kata Gellen; Dylan Cameron Peter
7392,HISTORY,265S,01,Religion and Politics in Post-Revolutionary Iran,"The relationship between religion and politics; Islam and politics; Islamic political theology and ethics; stages of Shi'ite Islam and politics; Iran between two revolutions; political Islam; Khomeini's political thought; Iranian Constitution; tension between theocracy, secularism, and democracy; quasi-democracy and elections; expediency and secularization; civil and Islamic law; Muslim fundamentalists, traditionalists, and reformists; from competitive electoral to the non-competitive electoral authoritarian regime; women's rights; religious and ethnical minorities; foreign policy; revolutionary guards; Khomeini and Khamenei administrations; the future of Islamic republic of Iran.",,1,SEM,E,Undergraduate,In Person,Duke University,Durham,Regular Academic Session,08/25/2025,12/05/2025,Open,18,10,8,0,18,Graded,Y,Mohsen Kadivar
9107,HISTORY,266,01,"The Good Life: Religion, Philosophy, and Life's Ultimate Concerns","What does it look like for a human life to go well? What leads to human flourishing or 'happiness' or 'success'? What is freedom? Love? Justice? What is the basis for ethics? What is our relationship to the natural world? What is the significance of death? How do our beliefs (or lack thereof) about God or the gods shape how we view the world? We will examine how philosophical or religious traditions around the globe have answered life's biggest questions. Traditions may include Confucianism, Islam, Christianity, Stoicism, Judaism, Buddhism, Hinduism, scientific naturalism, expressive individualism, and utilitarianism. Part of the Transformative Ideas Sophomore Program.",,1,LEC,E,Undergraduate,In Person,Duke University,Durham,Regular Academic Session,08/25/2025,12/05/2025,Open,170,167,3,0,170,Graded,Y,Abdullah Antepli; Alfredo W Watkins; C. Kavin Rowe; Daniel W McShea; Polly Ha; Richard Jaffe; Malachi H Hacohen
10823,HISTORY,268SA,01,Berlin Film City: Movies in the Metropolis,"A course about Berlin's rich and unparalleled cinema history. Screenings, readings, and visits to historical studios and cinemas, film museums, archives, and film academies. The course is structured around a series of iconic films about Berlin. Units on Weimar cinema, Nazi film, DEFA (East Germany's production studio), the New German Cinema of the 1970s and 80s, post-wall film, and the twenty-first century Berlin School. Students will engage in close analysis of films in their historical context and discuss how cinema engages with issues of national, political, religious, ethnic, gender and sexual identities. Offered in English in the Duke in Berlin summer program.",,1,SEM,E,Undergraduate,Study Away,Duke University,Berlin,Regular Academic Session,08/25/2025,12/05/2025,Open,18,2,16,0,18,Graded,Y,Christina J. Wegel
10942,HISTORY,268SA,02,Berlin Film City: Movies in the Metropolis,"A course about Berlin's rich and unparalleled cinema history. Screenings, readings, and visits to historical studios and cinemas, film museums, archives, and film academies. The course is structured around a series of iconic films about Berlin. Units on Weimar cinema, Nazi film, DEFA (East Germany's production studio), the New German Cinema of the 1970s and 80s, post-wall film, and the twenty-first century Berlin School. Students will engage in close analysis of films in their historical context and discuss how cinema engages with issues of national, political, religious, ethnic, gender and sexual identities. Offered in English in the Duke in Berlin summer program.",,1,SEM,E,Undergraduate,Study Away,Duke University,Berlin,Regular Academic Session,08/25/2025,12/05/2025,Open,18,0,18,0,18,Graded,Y,Departmental Staff
8969,HISTORY,273,01,Inventing the Environment: Ideas of Nature in Literature and History of Science,"Course will explore western conceptions of nature in the modern period. We will ask: How have differing views of nature represented new definitions of the human? How have perspectives on nature changed historically in tandem with other cultural developments? What does it mean to have ethical responsibilities towards natural entities? How are ideas of the environment formed, critiqued, and changed through imaginative and investigative practices such as those of science and literature? Views of the environment considered will include: resource, generative force, sacred space, ecological process, home, and apocalyptic wasteland. We will read diverse thinkers such as: Darwin, Blake, Thoreau, Humboldt, Goethe, Kafka, Theodor Storm, Haeckel, Lynn Margolis, and Octavia Butler.",,1,LEC,E,Undergraduate,In Person,Duke University,Durham,Regular Academic Session,08/25/2025,12/05/2025,Open,18,10,8,0,18,Graded,Y,Stefani Engelstein
8980,HISTORY,288,01,History of Inequality,This course familiarizes students with the field of Inequality Studies through examination of the causes and consequences of social inequality throughout history. It addresses theories of group and sub-group social stratification and ways that disparity operates across multiple axes of stigmatized identities. This is a required course for the minor in Inequality Studies.,,1,LEC,E,Undergraduate,In Person,Duke University,Durham,Regular Academic Session,08/25/2025,12/05/2025,Open,50,12,38,0,50,Graded,Y,Adriane Lentz-Smith
7012,HISTORY,297,01,The Holocaust,"Antisemitism and the Jewish question in Central Europe, the development of Nazi policy, the Final Solution in its different sites (ghetto, labor camps, extermination camps) and institutions (SS, Judenrat), the Holocaust's legacy. Historiographical debates and documentary research.",,1,LEC,E,Undergraduate,In Person,Duke University,Durham,Regular Academic Session,08/25/2025,12/05/2025,Open,40,15,25,0,40,Graded,Y,Mordechai Inbari
2851,HISTORY,306S,01,Reimagining Latin America and The Caribbean,"This course addresses the most critical problems and debates about Latin American and Caribbean history, culture, society, science, politics, inequality, human rights, and security. The course draws from the expertise of scholars, artists, and practitioners from Latin America and the Caribbean hosted by the Duke Center for Latin American and Caribbean Studies (CLACS) as Mellon Visiting Scholars, as well as Duke faculty and instructors part of the Council in Latin American and Caribbean Studies. Students gain direct access to understand key events and current scholarship, in addition to conceptual epistemological and ontological approaches from countries and regions of LA and the Caribbean.",,1,SEM,E,Undergraduate,In Person,Duke University,Durham,Regular Academic Session,08/25/2025,12/05/2025,Open,18,9,9,0,18,Graded,Y,Luz Rodriguez
5934,HISTORY,307,01,History of Economic Thought,"Approaches to economic problems from Aristotle to Keynes, emphasizing certain models and doctrines—their origins, relevance, and evolution. Readings from Mun, Quesnay, Adam Smith, Malthus, Ricardo, Marx, Walras, Veblen, and Keynes. Prerequisite: Economics 201D.",,1,LEC,E,Undergraduate,In Person,Duke University,Durham,Regular Academic Session,08/25/2025,12/05/2025,Closed,30,30,0,0,30,Graded,Y,Jason Samuel Brent
7025,HISTORY,311S,01,"Men, Women, and Sports: Topics in US Sports History","Examines the way sports have been tied to and expressed ideals of manhood and womanhood, race, class, and nation. Topics will vary but include boxing, Title IX, football, Olympics, baseball, etc.",,1,SEM,E,Undergraduate,In Person,Duke University,Durham,Regular Academic Session,08/25/2025,12/05/2025,Closed,18,18,0,0,18,Graded,N,Juliana Barr
7024,HISTORY,315S,01,The Emergence of the Atlantic Basin,"The forces unleashed by the expansion of European influence into the Atlantic Islands along the west and southwest coast of Africa, and across the Atlantic Ocean into the Americas.",,1,SEM,E,Undergraduate,In Person,Duke University,Durham,Regular Academic Session,08/25/2025,12/05/2025,Open,10,3,7,0,10,Graded,N,Barry Gaspar
7054,HISTORY,317,01,The National Parks in American Life,"This course will introduce students to the history and evolution of the national park system in the United States. Beginning with 19th century parks, it will explore the emergence of the park idea, evolving notions of conservation, indigenous displacement, establishment of the National Park Service in 1916, and the 20th and 21st-century expansion of the national park system to include both scenic or 'natural' and cultural and historical parks. The course will consider the relationship of the parks to American historical narratives; to tourism and recreation initiatives; and to environmental movements and science. Students will have the opportunity to investigate the history of one park of their choosing.",,1,LEC,E,Undergraduate,In Person,Duke University,Durham,Regular Academic Session,08/25/2025,12/05/2025,Closed,25,25,0,0,25,Graded,Y,Anne Mitchell Whisnant
7056,HISTORY,320,01,Sports and American Culture,"For over a century, sports have occupied a central role in American life. More than 'just games,' sports have been deployed in the form of meaningful spectacle, exerting a social impact beyond fields and courts. This course addresses the intersection of sports and American society since the nineteenth century, focusing on such themes as nationalism, race, gender, capitalism, and globalization. Through a cultural studies approach, we will better understand how ideas, power, and capital flow through sports to broad audiences. In the process, we will extensively discuss and debate the political dynamics that have long pervaded the sports world.",,1,LEC,E,Undergraduate,In Person,Duke University,Durham,Regular Academic Session,08/25/2025,12/05/2025,Open,50,32,18,0,50,Graded,N,Steven Marston
8671,HISTORY,322,01,Statecraft and Strategy,"Introduces students to the history of how leaders have seen the world and tried to shape it in war and peace. Begins with examination of foundational texts in the history of strategy from around the world. Lectures focus on case studies in diplomatic and military history from the ancient to the contemporary world and spanning the globe. Explores how changes in technology and society (and social mores) have impacted statecraft. Introduces students to the concept of strategy and its applications in statecraft and other fields such as activism, business, and politics. Assignments focus on applying the lessons of history to challenges facing the United States and other countries today.",,1,LEC,E,Undergraduate,In Person,Duke University,Durham,Regular Academic Session,08/25/2025,12/05/2025,Open,50,23,27,0,50,Graded,Y,Simon Miles; -
8699,HISTORY,330S,01,Oral History and Storytelling,"Explore the fields of oral history and public history by participating in a community-based project. Examine a wide variety of sources related to oral history and public history theory and practice including books, articles, digital history projects, exhibits, and guest speakers. Uncover the opportunities, challenges, and controversies associated with these fields. Use this knowledge to create public-facing dissemination of our research in collaboration with a community organization.",,1,SEM,E,Undergraduate,In Person,Duke University,Durham,Regular Academic Session,08/25/2025,12/05/2025,Open,11,10,1,0,11,Graded,Y,Jacey C Anderson
4115,HISTORY,331S,01,Illiberal Nondemocracies: Focus on Eastern Europe and Asia,"As of 2016, only 11% of the countries in the world are liberal democracies. Some insight about how illiberal regimes function is a must to understand what is going on in the world. In this course, we explore illiberal and/or nondemocratic regimes of Eastern Europe and Asia—a perfect laboratory for the subject. We develop nuanced ideas about key concepts such as elections, representation, party rule, dictatorship, populism, patronalism, authoritarianism, and totalitarianism as well as the dilemmas of freedom, security, corruption, and development. We study the regimes of countries such as Hungary, Russia, Turkey, China and follow the news to see how political regimes evolve in real time.",,1,SEM,E,Undergraduate,In Person,Duke University,Durham,Regular Academic Session,08/25/2025,12/05/2025,Open,12,9,3,0,12,Graded,Y,Mustafa O Tuna
8181,HISTORY,350S,01,Memory Bandits,"This seminar introduces students to multiple approaches to why and how to create memory, with a focus on contributing to a project underway at Catawba Trail Farm. We are particularly interested in how to tell difficult stories of slavery, segregation, and inequality through new sites and interpretive plans. Students will conduct interviews and archival research in coordination with a Bass Connections project, 'Making Meaning at Historic Places' and the Catawba Trail Farm, a non-profit organization that builds community and addresses food insecurity through community gardening. As part of their community-building efforts, the leaders of this project are interested in reclaiming the history of the enslaved people who lived and worked on this property outside Durham.",,1,SEM,E,Undergraduate,In Person,Duke University,Durham,Regular Academic Session,08/25/2025,12/05/2025,Open,18,5,13,0,18,Graded,Y,Robin Kirk
7016,HISTORY,352,01,"Immigrant Dreams, U.S. Realities: Immigration Policy History","Immigrants and immigration policy in the United States from 1850 to the present, with focus on origins and power of immigrant exclusion during three waves of migration: Northern European and Asian migrations between 1850 and 1880, Eastern European, Latin American, and Asian migrations, 1880-1920, and Latin American, African, and Asian migrations, post 1965. Immigrant roles in shaping policy debates, citizenship rights, labor movements, and American culture, past and present.",,1,LEC,E,Undergraduate,In Person,Duke University,Durham,Regular Academic Session,08/25/2025,12/05/2025,Open,30,23,7,0,30,Graded,Y,Gunther W Peck
7000,HISTORY,374,01,"Women, Gender, and Sexuality in U.S. History","Major questions relating to women and women's place in society over the course of U.S. history, broadly defined, from the colonial period to the present: How did different groups of women see themselves as women? How did views of women's sexuality change? How did men's and women's relationships and roles change? How did women understand their connections to the larger society? How did race, ethnicity, and class shape all those issues? Course uses a variety of materials, including novels, movies, images, and music to explore the ethical contours of women's lives in the past, following change over time to better understand women's position today.",,1,LEC,E,Undergraduate,In Person,Duke University,Durham,Regular Academic Session,08/25/2025,12/05/2025,Open,40,14,26,0,40,Graded,Y,Juliana Barr
8694,HISTORY,375,01,"The United States and the World, 1898 to the Present","Course explores the evolution of US foreign relations, from the Spanish-American War in 1898 through the challenges facing the Biden Administration. Will consider US foreign relations in a broad sense. US' political, economic, and cultural relations with other states, organizations, and individuals will all be considered, as will the role that domestic politics play in the making and execution of US foreign policy.",,1,LEC,E,Undergraduate,In Person,Duke University,Durham,Regular Academic Session,08/25/2025,12/05/2025,Open,50,46,4,0,50,Graded,Y,Susan E Colbourn; -; -
8898,HISTORY,390,01,Topics in History Lecture,Individual courses in this series may be taught more than once or on a one-time basis only.,LABOR/SOCIAL INEQUALITY,1,LEC,E,Undergraduate,In Person,Duke University,Durham,Regular Academic Session,08/25/2025,12/05/2025,Closed,15,15,0,0,15,Graded,Y,Orin Starn
9319,HISTORY,393,01,Research Independent Study,"Fall semester research independent study. Usually undertaken by students concurrently with the Honors Seminar, or with an instructor with whom they have had a course. Individual research in a field of special interest under the supervision of a faculty member, the central goal of which is a substantive paper or written report containing significant analysis and interpretation of a previously approved topic. Consent of instructor and director of undergraduate studies required.",,1,IND,E,Undergraduate,In Person,Duke University,Durham,Regular Academic Session,08/25/2025,12/05/2025,Closed,1,1,0,0,1,Graded,N,Simon C Partner
9379,HISTORY,393,02,Research Independent Study,"Fall semester research independent study. Usually undertaken by students concurrently with the Honors Seminar, or with an instructor with whom they have had a course. Individual research in a field of special interest under the supervision of a faculty member, the central goal of which is a substantive paper or written report containing significant analysis and interpretation of a previously approved topic. Consent of instructor and director of undergraduate studies required.",,1,IND,E,Undergraduate,In Person,Duke University,Durham,Regular Academic Session,08/25/2025,12/05/2025,Closed,1,1,0,0,1,Graded,N,Tamika Nunley
11009,HISTORY,393,03,Research Independent Study,"Fall semester research independent study. Usually undertaken by students concurrently with the Honors Seminar, or with an instructor with whom they have had a course. Individual research in a field of special interest under the supervision of a faculty member, the central goal of which is a substantive paper or written report containing significant analysis and interpretation of a previously approved topic. Consent of instructor and director of undergraduate studies required.",,1,IND,E,Undergraduate,In Person,Duke University,Durham,Regular Academic Session,08/25/2025,12/05/2025,Closed,1,1,0,0,1,Graded,N,Christopher John Coome
11127,HISTORY,393,04,Research Independent Study,"Fall semester research independent study. Usually undertaken by students concurrently with the Honors Seminar, or with an instructor with whom they have had a course. Individual research in a field of special interest under the supervision of a faculty member, the central goal of which is a substantive paper or written report containing significant analysis and interpretation of a previously approved topic. Consent of instructor and director of undergraduate studies required.",,1,IND,E,Undergraduate,In Person,Duke University,Durham,Regular Academic Session,08/25/2025,12/05/2025,Closed,1,1,0,0,1,Graded,N,Claudia Koonz
11128,HISTORY,393,05,Research Independent Study,"Fall semester research independent study. Usually undertaken by students concurrently with the Honors Seminar, or with an instructor with whom they have had a course. Individual research in a field of special interest under the supervision of a faculty member, the central goal of which is a substantive paper or written report containing significant analysis and interpretation of a previously approved topic. Consent of instructor and director of undergraduate studies required.",,1,IND,E,Undergraduate,In Person,Duke University,Durham,Regular Academic Session,08/25/2025,12/05/2025,Closed,1,1,0,0,1,Graded,N,Philip J Stern
11129,HISTORY,393,06,Research Independent Study,"Fall semester research independent study. Usually undertaken by students concurrently with the Honors Seminar, or with an instructor with whom they have had a course. Individual research in a field of special interest under the supervision of a faculty member, the central goal of which is a substantive paper or written report containing significant analysis and interpretation of a previously approved topic. Consent of instructor and director of undergraduate studies required.",,1,IND,E,Undergraduate,In Person,Duke University,Durham,Regular Academic Session,08/25/2025,12/05/2025,Closed,1,1,0,0,1,Graded,N,Thomas Robisheaux
11130,HISTORY,393,07,Research Independent Study,"Fall semester research independent study. Usually undertaken by students concurrently with the Honors Seminar, or with an instructor with whom they have had a course. Individual research in a field of special interest under the supervision of a faculty member, the central goal of which is a substantive paper or written report containing significant analysis and interpretation of a previously approved topic. Consent of instructor and director of undergraduate studies required.",,1,IND,E,Undergraduate,In Person,Duke University,Durham,Regular Academic Session,08/25/2025,12/05/2025,Closed,1,1,0,0,1,Graded,N,Gunther W Peck
11131,HISTORY,393,08,Research Independent Study,"Fall semester research independent study. Usually undertaken by students concurrently with the Honors Seminar, or with an instructor with whom they have had a course. Individual research in a field of special interest under the supervision of a faculty member, the central goal of which is a substantive paper or written report containing significant analysis and interpretation of a previously approved topic. Consent of instructor and director of undergraduate studies required.",,1,IND,E,Undergraduate,In Person,Duke University,Durham,Regular Academic Session,08/25/2025,12/05/2025,Closed,1,1,0,0,1,Graded,N,James G Chappel
11134,HISTORY,393,09,Research Independent Study,"Fall semester research independent study. Usually undertaken by students concurrently with the Honors Seminar, or with an instructor with whom they have had a course. Individual research in a field of special interest under the supervision of a faculty member, the central goal of which is a substantive paper or written report containing significant analysis and interpretation of a previously approved topic. Consent of instructor and director of undergraduate studies required.",,1,IND,E,Undergraduate,In Person,Duke University,Durham,Regular Academic Session,08/25/2025,12/05/2025,Closed,1,1,0,0,1,Graded,N,James G Chappel
11329,HISTORY,393,10,Research Independent Study,"Fall semester research independent study. Usually undertaken by students concurrently with the Honors Seminar, or with an instructor with whom they have had a course. Individual research in a field of special interest under the supervision of a faculty member, the central goal of which is a substantive paper or written report containing significant analysis and interpretation of a previously approved topic. Consent of instructor and director of undergraduate studies required.",,1,IND,E,Undergraduate,In Person,Duke University,Durham,Regular Academic Session,08/25/2025,12/05/2025,Closed,1,1,0,0,1,Graded,N,Adriane Lentz-Smith
11353,HISTORY,393,11,Research Independent Study,"Fall semester research independent study. Usually undertaken by students concurrently with the Honors Seminar, or with an instructor with whom they have had a course. Individual research in a field of special interest under the supervision of a faculty member, the central goal of which is a substantive paper or written report containing significant analysis and interpretation of a previously approved topic. Consent of instructor and director of undergraduate studies required.",,1,IND,E,Undergraduate,In Person,Duke University,Durham,Regular Academic Session,08/25/2025,12/05/2025,Closed,1,1,0,0,1,Graded,N,Peter Sigal
