class_nbr,subject,catalog_nbr,class_section,descr,catalog_description,topic,units,component,class_type,acad_career_descr,instruction_mode_descr,campus_descr,location_descr,session_descr,start_dt,end_dt,enrl_stat_descr,class_capacity,enrollment_total,enrollment_available,wait_tot,wait_cap,grading_basis,combined_section,instructors
6234,ICS,379,01,"Emerging Markets: Finance, Trade, Institutions and the World Economy","Analyzes rise of emerging markets/economies and their new role in the context of global economy. Focus on post-1970s growth of countries such as China, India, South Korea, Chile, Mexico, and Brazil (and/or other countries according to students' interests) with particular emphasis on financial, industrial/trading and institutional aspects, linking such rise to the emergence of vast global economic imbalances and new trend in capital and trade flows of the last decade. Explores economic and policy challenges these countries and their companies increasingly face and implications for the world economy. Prerequisite: Economics 201D and 210D.",,1,LEC,E,Undergraduate,In Person,Duke University,Durham,Regular Academic Session,01/08/2025,04/23/2025,Closed,30,34,0,0,30,Graded,Y,Giovanni Zanalda
8119,ICS,390S,01,Selected Topics in International Comparative Studies,"Topics vary from semester to semester, focusing either on specific world regions or particular comparative/global issues.",ART AND POLITICS TODAY,1,SEM,E,Undergraduate,In Person,Duke University,Durham,Regular Academic Session,01/08/2025,04/23/2025,Closed,12,12,0,0,12,Graded,Y,Esther Gabara; -
8308,ICS,390S,02,Selected Topics in International Comparative Studies,"Topics vary from semester to semester, focusing either on specific world regions or particular comparative/global issues.",LIVES IN THE LONG DURATION,1,SEM,E,Undergraduate,In Person,Duke University,Durham,Regular Academic Session,01/08/2025,04/23/2025,Open,12,3,9,0,12,Graded,Y,Corina Maria Stan
10295,ICS,391,01,Independent Study,"Individual non-research directed study in a field of special interest on a previously approved topic, under the supervision of a faculty member, resulting in an academic product. Consent of instructor and director of undergraduate studies required.",,1,IND,E,Undergraduate,In Person,Duke University,Durham,Regular Academic Session,01/08/2025,04/23/2025,Closed,1,1,0,0,1,Graded,N,Catherine Mathers; Rebecca Stein
5220,ICS,411S,01,Archiving and Visualizing Asia: Politics and Poetics of Knowledge Production,"Engages students in the practices and theories of archiving, documenting and curating marginal histories. Hands-on research in the archives of Duke's Rubenstein Special Collections and elsewhere. Examines histories of movements and encounters between the 'West' and 'Asia.' Teaches original archival research and documentary methods through guided excavations in digital, audiovisual, and material resources. Directed readings and special guest lectures guide students on how to think critically on the theories and praxis of knowledge production, collection, documentation, circulation, and consumption. Students curate projects for final research assignment.",,1,SEM,E,Undergraduate,In Person,Duke University,Durham,Regular Academic Session,01/08/2025,04/23/2025,Open,9,8,1,0,9,Graded,Y,Aimee Kwon
8531,ICS,422S,01,Imagining Freedom: Literature and Cinema of Decolonization in South Asia,"Exploring decolonization in South Asia through 20th and 21st century literature, cinema and political thought. Conceptions of freedom centering the perspectives of women, oppressed castes, adivasis. South Asian decolonization and its intersections with the Global Cold War. Literary manifestos of the Dalit Panthers, the Progressive Writers Association & Parallel Cinema. Decolonization and international solidarity as reflected in conference proceedings—Afro-Asian Association, South Asia-Palestine, Socialism and Nationalism. Role of languages, both English and vernacular literatures in South Asian decolonization. Genres of decolonization.",,1,SEM,E,Undergraduate,In Person,Duke University,Durham,Regular Academic Session,01/08/2025,04/23/2025,Open,9,5,4,0,9,Graded,Y,Preeti Singh
3553,ICS,424-1,01,Medical Anthropology,Cross-cultural study of health and illness. Prerequisites: Completion of both Writing 101 and any First Year Seminar.,,1,LEC,E,Undergraduate,In Person,Duke University,Durham,Regular Academic Session,01/08/2025,04/23/2025,Open,25,17,8,0,25,Graded,Y,Emily Rogers
3592,ICS,425S,01,Mobility,"Examine how individual humans move within a network or system through theories (e.g. Locke on portable property), vehicles (boats), travelers (pirates, pilgrims, migrants), media (books, money, gravestones, genealogies) to recognize the phenomenon of mobility and its consequences. This course enables you to cultivate an eye for seeing mobile phenomena, and to analyze how they are at the heart of the big issues: capitalism, colonialism, imperialism, race, religion, diaspora, migration and security.",,1,SEM,E,Undergraduate,In Person,Duke University,Durham,Regular Academic Session,01/08/2025,04/23/2025,Closed,18,18,0,0,18,Graded,Y,Engseng Ho
9642,ICS,426,01,Civil Society and Civic Engagement in the Middle East,"This course examines civil society and civic engagement in the Middle East and North Africa, critically assessing the role of civic engagement in promoting democracy in majority Muslim countries; engages with theoretical questions about applying Western civil society concepts in the MENA region and uses films to explore societal structures and ideal society models envisioned by MENA thinkers; also analyzes U.S. civic engagement entities to evaluate opportunities and challenges in fostering similar initiatives in MENA; students gain hands-on experience by developing or evaluating a MENA-related NGO or community-based organization (CBO) while emphasizing writing as a learning tool alongside a 20-hour service-learning project, deepening their understanding of civil society in MENA",,1,LEC,E,Undergraduate,In Person,Duke University,Durham,Regular Academic Session,01/08/2025,04/23/2025,Open,18,10,8,0,18,Graded,Y,Mbaye Lo
8573,ICS,439S,01,Critical Digital Studies,"Integrate frameworks in digital anthropology and critical digital studies to examine contemporary digital culture in/of East Asia. Examine how the digital highlights historical and ongoing issues in various East Asian contexts. Introduce digital anthropology and digital ethnographic methods, including debates on digital ethics.",,1,SEM,E,Undergraduate,In Person,Duke University,Durham,Regular Academic Session,01/08/2025,04/23/2025,Open,7,4,3,0,7,Graded,Y,Kimberly Hassel
5746,ICS,459S,01,"Photography in the Americas: War, Tourism, Art, and Protest","Since it emerged in the 19th century until today, the camera has framed our way of seeing and understanding the world. In this course, students accompany the camera in its path through major events in the Americas—North, South, and Central—and examine the profound connections between them. We discuss photography as a weapon of war, a souvenir for tourists, an instrument of protest, an illustration of history, a journalistic and ethnographic tool, and an artistic medium. Key developments in photographic processes, from half tone printing to digital imaging, offer opportunities to reflect on the relationship between visual culture and technology, and art and politics. Taught in Spanish.",,1,SEM,E,Undergraduate,In Person,Duke University,Durham,Regular Academic Session,01/08/2025,04/23/2025,Open,12,11,1,0,12,Graded,Y,Esther Gabara
2784,ICS,489S,01,Capstone: Global Studies Seminar,"Interdisciplinary seminar for senior ICS majors; uses scholarship, literature and film to revisit critical global and transnational studies concepts and themes from ICS 195 at a level appropriate for seniors; writing-intensive, with assignments to facilitate analytical thinking; individual reflection on classroom, study away, and work experiences; library research; and engagement with the university intellectual and creative environment. Prerequisite: International Comparative Studies 195/History 103/Political Science 178/Religion 195/Sociology 195. Open to senior International Comparative Studies majors only.",,1,SEM,E,Undergraduate,In Person,Duke University,Durham,Regular Academic Session,01/08/2025,04/23/2025,Closed,12,14,0,0,12,Graded,N,Natalie Gasparowicz
2783,ICS,496S,01,Senior Honors Seminar,Continuation of International Comparative Studies 495S. Open to seniors majoring in International Comparative Studies. Consent of instructor required.,,1,SEM,E,Undergraduate,In Person,Duke University,Durham,Regular Academic Session,01/08/2025,04/23/2025,Open,15,12,3,0,15,Graded,N,Adam Richard Rosenblatt; Melissa Karp; Sydney Paige Marshall
2785,ICS,502S,01,Graphic Ethnography: Comics as Research,"Comics offer researchers unique ways to portray time, memory, and speech on the page. In this course, we read global works of graphic ethnography, graphic medicine, comics journalism, and comics theory. We analyze the building blocks of the page and panel, ethics of drawn representations, and more, putting what we study into practice. The final project is a short Durham-based graphic ethnography; graduate students may, instead, integrate graphic narrative into a research project of their own. Interest in visual thinking is required, but no drawing background–comics can employ a wide array of representational strategies. Prerequisite: ICS 195, CULANTH 101D, VMS 202, or a 100-level DOCST course required for undergraduate students.",,4,SEM,E,Graduate,In Person,Duke University,Durham,Regular Academic Session,01/08/2025,04/16/2025,Open,18,10,8,0,18,Graded,Y,Adam Richard Rosenblatt
7708,ICS,524S,01,Theories of Violence,"Violence is a capacious concept that differs widely in terms of the context of its deployment. It can refer, for example, to expressions of state and legal authority, policing, and carceral practices; it can take on symbolic and epistemic forms in terms of processes of racialization, structures of social exclusion, and forms of bodily regulations; it can reflect the everyday enactment of personal injuries, entitlements, and power differentials; or it can designate the emancipatory force of revolutions, uprisings, and strikes. This course will attempt to explore these various facets of the concept of violence from a number of different disciplinary standpoints — including political philosophy, social theory, historical sociology, postcolonial studies, and critical race theory.",,3,SEM,E,Graduate,In Person,Duke University,Durham,Regular Academic Session,01/08/2025,04/16/2025,Open,18,14,4,0,18,Graded,Y,Nima R Bassiri
7852,ICS,577,01,Environmental Politics,"Environmental policy formation and implementation. Topics include interest groups, environmental movements and parties, public opinion, political systems and institutions.",GLOBAL ENVIRONMENTAL POLITICS,3,LEC,E,Graduate,In Person,Duke University,Durham,Regular Academic Session,01/08/2025,04/16/2025,Open,50,46,4,0,50,Graded,Y,John J Ewing; Savannah Carr-Wilson
8305,ICS,577,03,Environmental Politics,"Environmental policy formation and implementation. Topics include interest groups, environmental movements and parties, public opinion, political systems and institutions.",U.S. ENVIRONMENTAL POLITICS,3,LEC,E,Graduate,In Person,Duke University,Durham,Regular Academic Session,01/08/2025,04/16/2025,Open,40,17,23,0,40,Graded,Y,Jack Zhou
9627,ICS,590S,01,Topics in International Comparative Studies,"Topics vary, focusing on either specific global regions or particular comparative/transnational issues.",CRITICAL ANIMAL STUDIES,3,SEM,E,Graduate,In Person,Duke University,Durham,Regular Academic Session,01/08/2025,04/16/2025,Open,18,7,11,0,18,Graded,Y,Jieun Cho
9795,ICS,590S,02,Topics in International Comparative Studies,"Topics vary, focusing on either specific global regions or particular comparative/transnational issues.",CULTURES OF DECOLONIZATION,3,SEM,E,Graduate,In Person,Duke University,Durham,Regular Academic Session,01/08/2025,04/16/2025,Open,9,0,9,0,9,Graded,Y,Preeti Singh
7330,ICS,646S,01,Strategic Storytelling: Narratives for Development,"With a broad array of storytelling mediums, we ask how 'sticky' stories told about poverty or development strategically can add to our ability properly to understand poverty and to conduct appropriate development policies more effectively. What are the benefits and limitations of considering public policy problems by entering through the arts of storytelling and of storylistening? How do stories help readers/listeners become alive to ethical and cultural considerations previously unseen or unheard? How might these stories enable storytellers to tell stories on their own terms, opening up new and critically important terrains for public policy? Soft power strategy. Guest practitioners.",,3,SEM,E,Graduate,In Person,Duke University,Durham,Regular Academic Session,01/08/2025,04/16/2025,Closed,16,16,0,0,16,Graded,Y,Catherine Admay
