class_nbr,subject,catalog_nbr,class_section,descr,catalog_description,topic,units,component,class_type,acad_career_descr,instruction_mode_descr,campus_descr,location_descr,session_descr,start_dt,end_dt,enrl_stat_descr,class_capacity,enrollment_total,enrollment_available,wait_tot,wait_cap,grading_basis,combined_section,instructors
3547,ICS,101D,001,Introduction to Cultural Anthropology,Same as Cultural Anthropology 101 except instruction is provided in lecture and discussion group each week.,,1,LEC,N,Undergraduate,In Person,Duke University,Durham,Regular Academic Session,01/08/2025,04/23/2025,Open,65,64,1,0,65,Graded,Y,Orin Starn
3548,ICS,101D,01D,Introduction to Cultural Anthropology,Same as Cultural Anthropology 101 except instruction is provided in lecture and discussion group each week.,,0,DIS,E,Undergraduate,In Person,Duke University,Durham,Regular Academic Session,01/08/2025,04/23/2025,Closed,23,24,0,0,23,Graded,Y,Orin Starn
3549,ICS,101D,02D,Introduction to Cultural Anthropology,Same as Cultural Anthropology 101 except instruction is provided in lecture and discussion group each week.,,0,DIS,E,Undergraduate,In Person,Duke University,Durham,Regular Academic Session,01/08/2025,04/23/2025,Open,20,19,1,0,20,Graded,Y,Orin Starn
3550,ICS,101D,03D,Introduction to Cultural Anthropology,Same as Cultural Anthropology 101 except instruction is provided in lecture and discussion group each week.,,0,DIS,E,Undergraduate,In Person,Duke University,Durham,Regular Academic Session,01/08/2025,04/23/2025,Open,22,21,1,0,22,Graded,Y,Orin Starn
3259,ICS,102,01,Introduction to Dance,"Dance as a reflection of historical and current cultural values. Introduction to some of the major forms of world dance (for example, classical dances of Europe, Asia and Africa, and American modern dance); how dance forms illuminate and define gender, personal and group identity, political and religious status, aesthetic values, and the intentions of the dance-makers; dance as an educative force, a facilitator of cultural acquisition, and a reflection of cultural change; the function of dance in various cultural settings; how to look at dance, to analyze movement, and to read the text of dance structure.",,1,LEC,E,Undergraduate,In Person,Duke University,Durham,Regular Academic Session,01/08/2025,04/23/2025,Open,15,14,1,0,15,Graded,Y,Purnima Shah
5554,ICS,103,01,AIDS and Other Emerging Diseases,Explores the interaction of biology and culture in creating and defining diseases through an investigation of acquired immunodeficiency syndrome (AIDS) and other emerging diseases: molecular biology; biology of transmission and infection; the role of people and culture in the evolution of infectious diseases; reasons for the geographic variations in disease. The inductive-deductive methodology of science is both used to develop and test hypotheses as well as examined itself as an analytical tool. Intended for nonmajors.,,1,LEC,E,Undergraduate,In Person,Duke University,Durham,Regular Academic Session,01/08/2025,04/23/2025,Open,160,114,46,0,160,Graded,Y,Sherryl A Broverman
3577,ICS,107,01,Climate Change Now,"Readings and case studies in sustainable development, social entrepreneurship, and other attempts to address natural resource limitations, economic inequality, and social justice. Focuses on the problems that sustainability is intended to solve, competing definitions and values. Includes perspectives from development experts, for- and non-profit sector innovators, anthropologists and other social scientists.",,1,LEC,E,Undergraduate,In Person,Duke University,Durham,Regular Academic Session,01/08/2025,04/23/2025,Closed,25,25,0,0,25,Graded,Y,Christine Folch
3711,ICS,110,01,Introduction to African Studies (DS3 or DS4),"A range of disciplinary perspectives on key topics in contemporary African Studies: nationalism and pan-Africanism, imperialism and colonialism, genocide and famine, development and democratization, art and music, age and gender.",,1,LEC,E,Undergraduate,In Person,Duke University,Durham,Regular Academic Session,01/08/2025,04/23/2025,Open,60,58,2,0,60,Graded,Y,Charlie D Piot
3133,ICS,111,01,Traditions in Documentary Studies,"Traditions of documentary work seen through an interdisciplinary perspective, with an emphasis on twentieth-century practice. Introduces students to a range of documentary idioms and voices, including the work of photographers, filmmakers, oral historians, folklorists, musicologists, radio documentarians, and writers. Stresses aesthetic, scholarly, and ethical considerations involved in representing other people and cultures.",,1,LEC,E,Undergraduate,In Person,Duke University,Durham,Regular Academic Session,01/08/2025,04/23/2025,Open,40,12,28,0,40,Graded,Y,Wesley Hogan; Lauren Aimée Neefe; Sarah Adeline Soucek
3572,ICS,113,01,Introduction to Human Rights: Gateway for the Human Rights Certificate,"This is the Gateway course for the Human Rights Certificate. Students are introduced to the history, theory, practice of, and current issues in human rights. The course is interdisciplinary.",,1,LEC,E,Undergraduate,In Person,Duke University,Durham,Regular Academic Session,01/08/2025,04/23/2025,Closed,25,25,0,0,25,Graded,Y,Robin Kirk
4994,ICS,118,01,Science and the Modern World: Introduction to the History of Science,"This course surveys the history of science from the sixteenth century through the present day. It addresses science not just as a body of knowledge and methods but as a cultural activity that has shaped and been shaped by modern global history. Topics will range across physical sciences, life sciences, earth and environmental sciences, and social sciences. This course takes a global perspective, with emphasis on parallels, differences, and interconnections among ways of knowing nature in different places and times, as well as the role of specific materials, environments, technologies, and practical problems in the development of modern science.",,1,LEC,E,Undergraduate,In Person,Duke University,Durham,Regular Academic Session,01/08/2025,04/23/2025,Open,24,17,7,0,24,Graded,Y,Evan Hepler-Smith
3610,ICS,126,01,American Indians Go Graphic,"Introductory-level American Indian Studies course that explores historic and contemporary Native Nation-centric topics through the medium of comic books and graphic novels. These topics include representation and racialization, differing forms of activism, economic development, and settler-colonial impacts.",,1,LEC,E,Undergraduate,In Person,Duke University,Durham,Regular Academic Session,01/08/2025,04/23/2025,Open,25,9,16,0,25,Graded,Y,Courtney Lewis
4960,ICS,164S,01,"Gateway Seminar - Antisemitism: Ethnicity, Race, Religion, Culture","Focuses on selected anti-Judaic and antisemitic episodes from ancient antiquity through modern times, paying attention to both antisemitic texts and events. It evaluates competing theoretical frameworks for understanding antisemitism as ethnic, racial, religious and cultural phenomenon. Can antisemitism be understood as part of the history of racism or of other forms of ethnic hatred? Why were Jews so often target of hatred? How did both Jews and antisemites view their relations with each other? How do historians understand them? If there is limited continuity among antisemitic episodes, how can the prevalence and repetitiveness of antisemitism be explained?",,1,SEM,E,Undergraduate,In Person,Duke University,Durham,Regular Academic Session,01/08/2025,04/23/2025,Open,13,11,2,0,13,Graded,Y,Malachi H Hacohen
2776,ICS,195,01,Critical Approaches to Global Issues,"Introduction to critical transnational studies through several disciplinary approaches. Examines capitalism and neo-liberal globalization and their relationships to culture, politics, economics, and other social forms and outcomes; considers transnationalism 'from below'; addresses linear and Western-centric thinking about progress and modernity; focuses a historical lens on political discourses, institutions, and projects to understand them contextually; demonstrates how cultures and identities are dynamically constituted in interaction with historical, material, political, and situational factors; considers how different inequalities and contestations inflect most social formations.",,1,LEC,E,Undergraduate,In Person,Duke University,Durham,Regular Academic Session,01/08/2025,04/23/2025,Open,49,40,9,0,49,Graded,Y,Jessica Namakkal; Natalie Gasparowicz; -; -
3178,ICS,210,01,Languages of the World,"The major languages of the world viewed in the context of the communicative and significate functions of language as parameters that shape and define society. The role of language in defining and structuring culturally-based relationships from a semiotic point of view. The structure, writing systems, phonology, morphology, and lexicon of languages from the following groups: Indo-European, Semitic, Turkic, Finno-Ugric, Caucasian, Afroasiatic, Sino-Tibetan, Niger-Kordofanian, Dravidian, and Native American languages.",,1,LEC,E,Undergraduate,In Person,Duke University,Durham,Regular Academic Session,01/08/2025,04/23/2025,Open,32,24,8,0,32,Graded,Y,Dominika Marta Baran
4989,ICS,216,01,Gender and Socialism,"History of socialist feminism as a global political movement and philosophical-theoretical tradition with a special focus on its divergent national trajectories and conflict-ridden relationship with liberal feminism and socialist and communist movements and governments in Europe, Russia, China and US since the nineteenth century; offers an overview of European, Russian, Chinese and US history of the last two centuries; includes exploration of principles and aspirations that informed socialist theory of modern society, social justice, family, motherhood, parenthood, sexual difference, gender equality as well as public policies and legislation instituted or informed by the socialist tradition.",,1,LEC,E,Undergraduate,In Person,Duke University,Durham,Regular Academic Session,01/08/2025,04/23/2025,Open,18,6,12,0,18,Graded,Y,Anna Krylova
4941,ICS,218,01,Modern & Global India,"Examines the historical foundations for the emergence of India as a modern and global society with a focus on the Mughal empire, British colonialism, and Indian nationalism. Uses textual and visual sources for charting how local political, social-economic and cultural factors intersect with the global movements of peoples, goods, technologies, and ideas in the creation of the modern nation-state of India. Concludes with discussion of globalization of Indian labor, food, and Bollywood. Time frame from 1500 to present.",,1,LEC,E,Undergraduate,In Person,Duke University,Durham,Regular Academic Session,01/08/2025,04/23/2025,Open,45,44,1,0,45,Graded,Y,Avrati Bhatnagar
5240,ICS,226,01,The Black Atlantic,"The African diaspora—a direct result of the transatlantic slave trade and Western colonialism—has generated a wide array of artistic achievements, from the 'shotgun' houses of New Orleans to the urban graffiti of NYC. The course surveys several major cultural groups in West and Central Africa and their aesthetic impact on the arts, religions, and philosophies of peoples of African descent in South America, the Caribbean, and the United States.",,1,LEC,E,Undergraduate,In Person,Duke University,Durham,Regular Academic Session,01/08/2025,04/23/2025,Open,24,5,19,0,24,Graded,Y,Richard J Powell
10424,ICS,235S,02,Writing for Global Audiences – Theories and Applications of Comparative Rhetoric,"This course examines how writing practices and communication strategies are shaped by cultural differences, focusing on how writers construct, adapt, and negotiate voice and identity for global audiences. We will analyze rhetorical traditions through non-Eurocentric theories—spanning cultural, geographical, and non-human perspectives—via rigorous reading, case studies, and discussion. By examining real-world examples like protest writings, we will explore methodologies for effective global communication. We will refine rhetorical knowledge through collaborative learning, honing adaptive, ethical, and sophisticated writing practices that meet the expectations of diverse global audiences.",,1,SEM,E,Undergraduate,In Person,Duke University,Durham,Regular Academic Session,01/08/2025,04/23/2025,Open,15,2,13,0,15,Graded,Y,Yan Li
5234,ICS,236S,01,From Ottoman Empire to the Modern Middle East,"Major cultural, political and historical issues in the transition from the late Ottoman Empire to the Modern Middle East. Emphasis on Ottoman legacies in the 20th century. Readings and discussions analyze end of empire through colonial intervention, WWI, the caliphate, political violence, cultural revolution, national self-determination, coups, post-colonial states, and Islamist mobilization. Interdisciplinary focus on cultural texts, including film, popular culture and literature. Thematic discussions on women/gender, identity- and state-formation, historiography, and hierarchies of race and religion.",,1,SEM,E,Undergraduate,In Person,Duke University,Durham,Regular Academic Session,01/08/2025,04/23/2025,Open,18,7,11,0,18,Graded,Y,Erdag M Goknar
4955,ICS,237,01,Europe in the Twentieth Century,"An examination, emphasizing cultural and political trends, of the turning points that have shattered political unity (two world wars, economic depression, protest movements, the Cold War and ethnic strife), as well as forces for unification (modernist literature, film and music, political ideologies, the Common Market, and post-1989 revival).",,1,LEC,E,Undergraduate,In Person,Duke University,Durham,Regular Academic Session,01/08/2025,04/23/2025,Open,25,6,19,0,25,Graded,Y,Yooseong Heo
5482,ICS,271,01,Business Ethics: The Debate Over Corporate Social Responsibility,"Debates about obligations of firms and business leaders over and above legal obligations. Examination of foundations and implications of corporate governance, corporate law, and the theory of the firm. Evaluation of challenges by supporters of stakeholder theory and corporate social responsibility.",,1,LEC,E,Undergraduate,In Person,Duke University,Durham,Regular Academic Session,01/08/2025,04/23/2025,Open,18,4,14,0,18,Graded,Y,Wayne John Norman
8087,ICS,275,01,"Left, Right, and Center: Competing Political Ideals","Analysis of liberalism, conservatism, socialism, and their diverse conceptions of justice, freedom, community, and equality. Exploration of how these political philosophies interpret various social, religious, and political issues. The origins of these ideologies in early modern European thought.",,1,LEC,E,Undergraduate,In Person,Duke University,Durham,Regular Academic Session,01/08/2025,04/23/2025,Open,36,32,4,0,36,Graded,Y,Anna Marisa Schön
8025,ICS,281,01,"K-Pop, Idols, and Fandom","This course explores the complex relationship between Korean popular music (K-Pop) idols and the complex global online (anti-)fandoms that have formed around these industry entertainers. Through a critical analysis of K-Pop music videos, and documentaries, this course examines the historical roots of idol culture in South Korea, the current state of the K-Pop industry, fan behaviors, and the global expansion of K-Pop fandom to understand how these dynamics shape both the industry and the idols themselves. This course nuances concerns about what drives one to become an idol and what it means to be a fan by engaging in moral and ethical debates surrounding the emerging Western consumption of a predatory music genre with its own complex relationship to global music flows.",,1,LEC,E,Undergraduate,In Person,Duke University,Durham,Regular Academic Session,01/08/2025,04/23/2025,Closed,25,28,0,0,25,Graded,Y,Cody Black
2811,ICS,286,01,Introduction to Asian American and Diaspora Studies,"What does it mean to be Asian American? Asian American Studies is an interdisciplinary field that draws on social sciences, humanities, and the arts to explore the historical and contemporary experiences of Asian Americans in the western hemisphere. This course provides students with an introduction to this dynamic and growing field of study, taking race, gender, immigration, diaspora, class, labor, and sexuality as primary subjects of the field. The course also historicizes Asian American racialization to better understand the structural forces that have shaped Asian American lives and the ways that writers, scholars, and activists have responded to and resisted these forces.",,1,LEC,E,Undergraduate,In Person,Duke University,Durham,Regular Academic Session,01/08/2025,04/23/2025,Open,25,17,8,0,25,Graded,Y,Jaeyeon Yoo
9436,ICS,290S,01,Selected Topics in International Comparative Studies,Seminar version of International Comparative Studies 290.,JAPANESE CUISINE,1,SEM,E,Undergraduate,In Person,Duke University,Durham,Regular Academic Session,01/08/2025,04/23/2025,Open,18,16,2,0,18,Graded,Y,Eric Funabashi
4523,ICS,299,01,Ethics of Global Infectious Disease Control,"Examination of the role of ethical decision-making when controlling infectious disease epidemics. Applies classic public health ethics of balancing individual liberty vs. public good to the new global health context of emerging infectious diseases such as HIV/AIDS, Ebola, and SARS, plus re-emerging infectious diseases such as multidrug-resistant TB, polio, and cholera. Explores questions of resource allocation, mandatory or voluntary prevention measures, and ethical obligations of health care workers vs. responsibilities of individuals in the context of new global public health. Prior global health coursework recommended.",,1,LEC,E,Undergraduate,In Person,Duke University,Durham,Regular Academic Session,01/08/2025,04/23/2025,Open,35,14,21,0,35,Graded,Y,Kearsley Stewart
3704,ICS,308,01,Development and Africa,"Addresses the vexed issue of economic development in Africa - its many failures, its occasional successes - from the early colonial period to the present. Focuses especially on the transition from the 1960s 'modernizing' moment to the millennium projects and humanitarian aid of the present. Will read the works of development experts, World Bank executives, anthropologists and historians, asking why this massively financed project has experienced such failure and exploring what can be done.",,1,LEC,E,Undergraduate,In Person,Duke University,Durham,Regular Academic Session,01/08/2025,04/23/2025,Open,30,26,4,0,30,Graded,Y,Beletchei Ebia; Charlie D Piot
3275,ICS,309S,01,"Dancing States of Mind: The Self, Social and Political Practice of Dance","Practice-based studio work, discussion, and readings in current political discourse, System Theory, contemporary philosophy and cultural theory. Reveals the culturally constructed nature of dance in Western society - its manner of production, dissemination and aesthetics - and examines the consequences of 'the cultured flesh' as a mode of propaganda. The cultivation of students' radically subjective creativity, artistic experimentation, awareness, perception and expression, in order to understand and challenge the status quo; and to integrate abstract concepts into one's own physical existence and redefine assumptions by moving right through them.",,1,SEM,E,Undergraduate,In Person,Duke University,Durham,Regular Academic Session,01/08/2025,04/23/2025,Open,10,7,3,0,10,Graded,Y,Michael Klien
8072,ICS,314S,01,Doing Global Research,"Introduces students to interdisciplinary research methods and theories to conduct global research. Students build on concepts foundational to global studies by reading about and practicing variety of research methods including archival and oral history, interviews, mapping, textual analysis, and ethnography. Texts, discussions, and projects focus on theoretical frameworks engaging politics of research, approaching global research from below,reaching underrepresented populations and social groups, exploring connections between power and knowledge, nontraditional and creative formats for research. Course examines how interdisciplinary research can expand traditional fields.",IMAGINATIVE PRACTICES & CREAT,1,SEM,E,Undergraduate,In Person,Duke University,Durham,Regular Academic Session,01/08/2025,04/23/2025,Open,16,10,6,0,16,Graded,N,Cade Bourne; Catherine Mathers
8527,ICS,327S,01,9/11 and The Global Novel,"Reading 9/11— the destruction of the World Trade towers in New York and the subsequent 'war on terror', through its representation in novels from South Asia, Middle East and their diaspora. Alternate genealogies of 9/11 within the larger history of the global cold war. Close attention to the novel form alongside debates in novel theory and world literature. Comparing representations of 9/11 in novels from South Asia with those in the Western media to ask questions grounded in political and critical theory. No language requirements. Class discussions/reading responses, mid-term presentation, and final paper developed over the semester.",,1,SEM,E,Undergraduate,In Person,Duke University,Durham,Regular Academic Session,01/08/2025,04/23/2025,Open,18,9,9,0,18,Graded,Y,Preeti Singh
3584,ICS,328,01,Anthropology of Money,"We will explore the history and theory of money – what it represents, how it circulates, the meanings it carries, its contemporary transformations – not only in the West but also in the global south. Some of the topics to be considered include shell currencies, gift economies, Ponzi schemes, paperless money, derivatives and futures, hedge funds, and global debt.",,1,LEC,E,Undergraduate,In Person,Duke University,Durham,Regular Academic Session,01/08/2025,04/23/2025,Closed,103,103,0,0,103,Graded,Y,Charlie D Piot
5210,ICS,333S,01,"Storyworlds: The Art, Technology, and Pleasure of Narrative","Is 'tell me a story' an universal imperative? Seminar examines storytelling practices across a broad span of histories and cultures, and the creation of storyworlds through multiple media, genres, and platforms. Topics include comparative oral traditions, Medieval story cycles, serial tales, textual poaching and fanfic, alternate reality gameworlds (ARG), social media, transmedia storytelling and transcultural fandoms.",,1,SEM,E,Undergraduate,In Person,Duke University,Durham,Regular Academic Session,01/08/2025,04/23/2025,Open,18,17,1,0,18,Graded,Y,Eileen Chow
8541,ICS,343S,01,War,"This course seeks to critically understand a fundamental aspect of the increasingly interconnected global present through examining the question war. It will draw on works from different disciplines (anthropology, history, critical theory, fiction, political science, American studies), and we will constantly move across them, as it seeks to examine how war is conceptualized by different intellectual traditions and theoretical approaches and is experienced by multiple actors. In doing so, it will focus primarily, but not exclusively on the connections between US and the Arab World.",,1,SEM,E,Undergraduate,In Person,Duke University,Durham,Regular Academic Session,01/08/2025,04/23/2025,Open,18,8,10,0,18,Graded,Y,Fadi Abdo Bardawil
5200,ICS,345S,01,Turkish Cultural History through the Novels of Orhan Pamuk,"An introduction into Turkish history (including the Ottoman Empire) through a comparative study of the historical novels and nonfiction of Nobel Laureate Orhan Pamuk. Addresses Pamuk's role as an intellectual-author who mediates between Islamic culture, secular modernity, the Turkish national tradition and an international canon of literature. Political implications of Sufism, cultural revolution, Orientalism, and post-colonialism. Secondary focus on representations of cosmopolitan Istanbul, political Islam and the military coup. Taught in English.",,1,SEM,E,Undergraduate,In Person,Duke University,Durham,Regular Academic Session,01/08/2025,04/23/2025,Open,18,10,8,0,18,Graded,Y,Erdag M Goknar
6152,ICS,348,01,Gender in the Economy,Economics of gender including the status of women in the labor market; feminist economic theories; ethical considerations of gender-based inequalities; gendered division of labor within the family and between the household and labor market. Comparisons of women's status across different cultures and geographic areas; gender-related measurements and indicators; explanations and remedies for female/male occupational segregation and wage differentials. Prerequisite: Economics 201D.,,1,LEC,E,Undergraduate,In Person,Duke University,Durham,Regular Academic Session,01/08/2025,04/23/2025,Closed,40,42,0,0,40,Graded,Y,Genna R Miller
4510,ICS,349,01,Global Health Ethics in Research,"Introduces ethical and human rights concepts in Global Health and current issues in health ethics. Explores how to understand and engage in ethical health service, intervention, research and education. Requires students analyze and critique ethical choices of individuals, policy-makers and health workers. Explores standards of care, access to care, best outcomes vs. distributed justice. Focuses on ethics related to infectious diseases; obesity, alcohol and tobacco; and environmental health.",,1,LEC,E,Undergraduate,In Person,Duke University,Durham,Regular Academic Session,01/08/2025,04/23/2025,Closed,40,42,0,0,40,Graded,Y,Sumedha Ariely
