class_nbr,subject,catalog_nbr,class_section,descr,catalog_description,topic,units,component,class_type,acad_career_descr,instruction_mode_descr,campus_descr,location_descr,session_descr,start_dt,end_dt,enrl_stat_descr,class_capacity,enrollment_total,enrollment_available,wait_tot,wait_cap,grading_basis,combined_section,instructors
7769,ARABIC,101,01,Elementary Arabic,"Understanding, speaking, reading, and writing modern standard Arabic. Language laboratory.",,1,LEC,E,Undergraduate,In Person,Duke University,Durham,Regular Academic Session,01/07/2026,04/22/2026,Open,18,10,8,0,18,Graded,N,Badr Abdelfatta Badr; Maha Houssami
7770,ARABIC,102,01,Elementary Arabic,Continuation of Arabic 101. Prerequisite: Arabic 101 or equivalent.,,1,LEC,E,Undergraduate,In Person,Duke University,Durham,Regular Academic Session,01/07/2026,04/22/2026,Open,18,9,9,0,18,Graded,N,Badr Abdelfatta Badr; Saad Cheikh Abdi ValL
7771,ARABIC,102,02,Elementary Arabic,Continuation of Arabic 101. Prerequisite: Arabic 101 or equivalent.,,1,LEC,E,Undergraduate,In Person,Duke University,Durham,Regular Academic Session,01/07/2026,04/22/2026,Open,18,7,11,0,18,Graded,N,Amal Boumaaza
9874,ARABIC,203,02,Intermediate Arabic,"Targets intermediate level proficiency in Modern Standard Arabic though a communicative approach emphasizing daily life themes and essential grammatical structures. Assessment includes quizzes, writing, oral presentations, exams, and OPI. Active participation and a regular homework are crucial. Covers Chapters 14-20 in 'Al-Kitaab Fi Ta'allum Al-'arabiyya Part 1 (2nd edition) and supplementary material provided by the instructor. Recommended prerequisite: Arabic 102 or equivalent.",,1,LEC,E,Undergraduate,In Person,Duke University,Durham,Regular Academic Session,01/07/2026,04/22/2026,Open,12,6,6,0,12,Graded,N,Badr Abdelfatta Badr
9873,ARABIC,204,02,Intermediate Arabic,"A mid-high intermediate course that focuses primarily on Modern Standard Arabic while also introducing an Arabic dialect of students' choice (Egyptian, Levantine or Moroccan) through media resources and the Aflaam site. Chapters 1-5 in 'Al-Kitaab Fii Ta'allum Al-'arabiyya Part 2' (2nd edition) are covered targeting mastery of grammatical concepts, such as verb tenses and participles while also expanding students' vocabulary. Assessment comprises quizzes, writing, oral presentations, mid-term a final exam, and an Oral Proficiency Interview in Arabic. Recommended prerequisite: Arabic 203 or equivalent.",,1,LEC,E,Undergraduate,In Person,Duke University,Durham,Regular Academic Session,01/07/2026,04/22/2026,Open,12,5,7,0,12,Graded,N,Amal Boumaaza; Badr Abdelfatta Badr
7774,ARABIC,306,01,Advanced Arabic,"Students will transition from reading short texts to completing a full novel, Sayyidi wa Habibi by Hoda Barakat. Focus on analyzing and discussing literary content. Students will strengthen their reading, writing, speaking, and comprehension skills. includes a service-learning component with native speakers. Recommended prerequisite: Arabic 305 or equivalent.",,1,LEC,E,Undergraduate,In Person,Duke University,Durham,Regular Academic Session,01/07/2026,04/22/2026,Open,12,4,8,0,12,Graded,N,Saad Cheikh Abdi ValL
9864,ARABIC,782,01,Arabic For Graduate Students,"Completion of a regular Arabic class and a linguistics seminar. Topics vary from linguistics, language acquisition and teaching, and acquisition of a less commonly taught language. Learning Arabic as well as the underlying mechanism of second language acquisition.",,3,LEC,E,Graduate,Online,Duke University,Online,Regular Academic Session,01/07/2026,04/15/2026,Open,5,3,2,0,5,Graded,N,Yunchuan Chen
