class_nbr,subject,catalog_nbr,class_section,descr,catalog_description,topic,units,component,class_type,acad_career_descr,instruction_mode_descr,campus_descr,location_descr,session_descr,start_dt,end_dt,enrl_stat_descr,class_capacity,enrollment_total,enrollment_available,wait_tot,wait_cap,grading_basis,combined_section,instructors
4804,LSGS,305,01,Advanced Spanish for Heritage Learners,"This course is designed for heritage or bilingual students who grew up speaking Spanish at home, but have been educated almost exclusively in English. Together we will explore, reflect, and express opinions about topics that affect the diverse Latino communities in the United States such as: identity, bilingual education, immigration, health and human rights issues. Through reading current news and literary works, and listening and watching audiovisual media, students will develop the ability to read and write in Spanish in formal contexts, and also comprehend and compare the diversity and commonality of their Hispanic heritage.",,1,LEC,E,Undergraduate,In Person,Duke University,Durham,Regular Academic Session,01/07/2026,04/22/2026,Wait List,12,12,0,7,12,Graded,Y,Joan Munne
4919,LSGS,306,01,"Health, Culture, and the Latino Community","Exploration of health issues in the Spanish-speaking world shaped by social, cultural, political, ethnic, and economic determinants. Topics: cultural competency, community beliefs, medical practices and policies, preventive medicine, mental health. Projects include presentations, writing, research, and conversations with local and global contacts. Evaluation on knowledge of content, oral and written proficiency in Spanish. One 300-level Spanish course recommended prior to enrolling. Prerequisite: Spanish 204 or equivalent.",,1,LEC,E,Undergraduate,In Person,Duke University,Durham,Regular Academic Session,01/07/2026,04/22/2026,Wait List,15,15,0,3,15,Graded,Y,Melissa Simmermeyer
4888,LSGS,306-1,01,"Health, Culture, and the Latino Community: Service Learning","Exploration of health issues in the Spanish-speaking world shaped by social, cultural, political, ethnic, and economic determinants. Topics: cultural competency, community beliefs, medical practices and policies, preventive medicine, mental health. This is a service-learning or community-engaged course. Engagement may include direct, project-based, or research-focused service with local/global community partners among other engaged practices. Evaluation on knowledge of content, oral and written proficiency in Spanish. One 300-level Spanish course recommended prior to enrolling. Prerequisite: Spanish 204 or equivalent.",,1,LEC,E,Undergraduate,In Person,Duke University,Durham,Regular Academic Session,01/07/2026,04/22/2026,Wait List,15,15,0,4,15,Graded,Y,Joan E Clifford
4838,LSGS,307S,01,Issues of Education and Immigration,"Topics include Latino/a/x identities, educational pathways for Spanish-speakers in our community, relevant public policy and legislation, and social action. Required 20 hours outside of class with assigned community partners. Assessment on knowledge of content, oral and written Spanish, and participation in service. One 300-level Spanish course recommended prior to enrolling.",,1,SEM,E,Undergraduate,In Person,Duke University,Durham,Regular Academic Session,01/07/2026,04/22/2026,Wait List,15,15,0,5,15,Graded,Y,Rebecca Amelia Ewing
5513,LSGS,316,01,Sociology of Racism in America,"Examines social history of major racial groups in the US and relationships to contemporary standing. Discusses central concepts sociologists use to analyze racial matters. Central theme: 'racism' is not mere 'prejudice,' 'ignorance,' or 'intolerance,' but a comprehensive historical system of racial domination organized around the logic of white supremacy. Discussion of 'whiteness' in the USA—how whiteness emerged as a social category, an identity based on experiences of variety of European 'peoples;' how it dominated the racial structure of the US since the 17th century, how wealth has been distributed along racial lines, racialization of Asians and Latinos, and color blind racism.",,1,LEC,E,Undergraduate,In Person,Duke University,Durham,Regular Academic Session,01/07/2026,04/22/2026,Open,35,10,25,0,35,Graded,Y,Eduardo Bonilla-Silva
2738,LSGS,330S,01,Undocumented America in Literature,"This seminar explores the representation of lived experiences, trajectories, and current events vis-à-vis the figure of the undocumented migrant, in contemporary American literature. Testimonial accounts, journalism chronicles, memoirs, poetry, cinematic works, and critical scholarship inform and propel our study of the experience of ('illegal') migrant movement––departure, journey, and arrival––as portrayed in Latino and Latina literature. We will question status designations such as 'illegal,' 'undocumented,' and 'unauthorized'; 'legitimacy' and recognition; the inadmissible and the construction of 'suspect' bodies; social participation in US society.",,1,SEM,E,Undergraduate,In Person,Duke University,Durham,Regular Academic Session,01/07/2026,04/22/2026,Open,18,8,10,0,18,Graded,Y,Claudia Milian
4862,LSGS,336,01,Introduction to US Latino/a Literature,"Survey of US Latino/a Literature from 1960s to present. Examines formation of a Latino/a literary canon, its heterogeneous voices and imaginations, thematic strands, historical and political contexts, theoretical approaches, establishing critical overview of the range of nationalities, communities, identifications, and practices falling under the Latino/a designation. Explores how Latina and Latino identities have been envisioned and manifested since the Civil Rights Movement, and how Latina- or Latino-specific cultural production continues in dialogue with US multiracial landscape. Not open to students who have taken Spanish 336A. In English; does not satisfy Trinity FL requirement.",,1,LEC,E,Undergraduate,In Person,Duke University,Durham,Regular Academic Session,01/07/2026,04/22/2026,Wait List,18,18,0,1,18,Graded,Y,Claudia Milian
8054,LSGS,422S,01,Indigenous Futurisms: Sentient Territories and Decolonial Futures,"This class will explore how indigenous creators and intellectuals from Latin America intervene in the narratives of the past, reformulate the present, and imagine the future utilizing ancestral knowledge, environmental ethics, and decolonial thinking. We will discuss issues related to indigenous sovereignty and self-determination through the work of Felipe Guaman Poma de Ayala, José Carlos Mariátegui, Micaela Bastidas, Arguedas, the Qhipa Pacha Collective, Daniel Munduruku, E.G. Condé, Federico Cuatlacuatl, among others. We will also examine how the future becomes a territory where technology, the revitalization of languages, and nature coexist. This class aims to reflect on themes of time, memory, coloniality, and environmental advocacy.",,1,SEM,E,Undergraduate,In Person,Duke University,Durham,Regular Academic Session,01/07/2026,04/22/2026,Wait List,18,18,0,0,18,Graded,Y,Angelica Serna Jeri
