class_nbr,subject,catalog_nbr,class_section,descr,catalog_description,topic,units,component,class_type,acad_career_descr,instruction_mode_descr,campus_descr,location_descr,session_descr,start_dt,end_dt,enrl_stat_descr,class_capacity,enrollment_total,enrollment_available,wait_tot,wait_cap,grading_basis,combined_section,instructors
3130,DOCST,705S,01,The Documentary Experience: A Video Approach (A),"A documentary approach to the study of local communities through video production projects assigned by the course instructor. Working closely with these groups, students explore issues or topics of concern to the community. Students complete an edited video as their final project. Not open to students who have taken this course as DOCST 105S. Open only to graduate students in the MFAEDA program. Consent of instructor required.",,3,SEM,E,Graduate,In Person,Duke University,Durham,Regular Academic Session,08/25/2025,11/25/2025,Open,1,0,1,0,1,Graded,N,GARY Hawkins
3135,DOCST,714S,01,Introduction to Black and White Photography,"Foundation class in photography utilizing black and white film and a wet darkroom. Shoot, process, and print individual student work throughout the semester. Emphasis on continual visual exploration of meaning and metaphor in the form of regular assignments, slide lectures of important historic and contemporary photographic work, and critiques of each other's work. No textbooks are required, though students will need to budget a comparable amount for supplies and equipment. Open only to graduate students in the MFAEDA program.",,3,SEM,E,Graduate,In Person,Duke University,Durham,Regular Academic Session,08/25/2025,11/25/2025,Closed,1,2,0,0,1,Graded,N,Susie Post-Rust
8706,DOCST,725S,01,Documenting Resistance on Film: The Poor People's Campaign from 1968 to Today,"This documentary course explores the rich archival landscape and contemporary reverberations of the 1968 Poor People's Campaign, a transformative social movement that radically challenged economic inequality and systemic poverty across racial lines in the United States. Students will develop their research and filmmaking skills through hands-on engagement with historical materials and documentary techniques in order to explore the role of cultural production in movement spaces. Working independently and collaboratively, students will analyze how archives shape our understanding of history, study contemporary creative approaches to documentary, and learn practical skills for film production.",,3,SEM,E,Graduate,In Person,Duke University,Durham,Regular Academic Session,08/25/2025,11/25/2025,Closed,2,2,0,0,2,Graded,N,Elizabeth M Webb
8700,DOCST,730S,01,Oral History and Storytelling,"Explore the fields of oral history and public history by participating in a community-based project. Examine a wide variety of sources related to oral history and public history theory and practice including books, articles, digital history projects, exhibits, and guest speakers. Uncover the opportunities, challenges, and controversies associated with these fields. Use this knowledge to create public-facing dissemination of our research in collaboration with a community organization.",,3,SEM,E,Graduate,In Person,Duke University,Durham,Regular Academic Session,08/25/2025,11/25/2025,Closed,2,4,0,0,2,Graded,Y,Jacey C Anderson
6908,DOCST,734S,01,Creative Non-Fiction Cinema—Representing The Real,"The possibilities and contradictions of documentary practices are our starting point for an investigation of historic film and video works that use formally inventive strategies to represent, re-think, interrogate, or effect reality. Students will engage in video production processes, exploring issues such as power relations between maker, subject and viewer, the ability and limits of an image to act as evidence, flows between ethnographic practice and colonial ideologies, and the truth-telling possibilities of fictional invention. Students will screen, read, write, discuss, and complete conceptually focused production exercises using video, photography, text, and/or sound. No prior experience needed. Graduate-level research expected, parameters developed individually.",,3,SEM,E,Graduate,In Person,Duke University,Durham,Regular Academic Session,08/25/2025,11/25/2025,Open,2,1,1,0,2,Graded,Y,Jenny Lion
3129,DOCST,735S,01,Introduction to Audio Documentary,"Practicing the research, recording, and digital production of short audio (podcast or public radio-style) documentaries. Through listening in and out of class, exposure to various approaches from journalistic to narrative to artistic. Exploration of audio documentary as a medium for telling stories and examining issues of social and cultural significance and for advancing equity and justice. Substantial, deeply researched, professionally produced audio final project with a minimal length of twenty minutes, and a written essay reflecting on lessons learned about audio documentary as a field of inquiry. Open only to graduate students in the MFAEDA program.",,3,SEM,E,Graduate,In Person,Duke University,Durham,Regular Academic Session,08/25/2025,11/25/2025,Closed,2,2,0,0,2,Graded,N,John H Biewen
3128,DOCST,736S,01,Color Photography: Fieldwork and Digital Color,"Field-based course examining color photography as a documentary tool. Students learn about aesthetic and technical foundations of color photography using recent digital technology. Class-conducted intensive examination of the work of historic and contemporary color documentary photographers. Advanced techniques in film scanning, Photoshop, and color pigment printing. Completion of semester-long color photographic project, and final project consisting of production of a series of color pigment prints. Open only to graduate students in the MFAEDA program. Consent of instructor required.",,3,SEM,E,Graduate,In Person,Duke University,Durham,Regular Academic Session,08/25/2025,11/25/2025,Closed,2,2,0,0,2,Graded,N,William Bamberger
6861,DOCST,757S,01,Editing for Film and Video,"Theory, history, and practice of film and video editing techniques. Exploration of narrative, documentary and experimental approaches to structuring moving image materials, using digital non-linear editing. Course work will include screening, reading, writing, editing exercises, and video production projects, culminating in a final class screening. No prior experience necessary. Graduate students will be required to complete more advanced assignments and/or additional projects.",,3,SEM,E,Graduate,In Person,Duke University,Durham,Regular Academic Session,08/25/2025,11/25/2025,Closed,1,2,0,0,1,Graded,Y,Jenny Lion
3061,DOCST,850S,01,Deleuze: Cinema and Philosophy,"Examination of Gilles Deleuze's books: CINEMA 1 and CINEMA 2. Exploration of his concepts of the 'movement-image' and the 'time-image' with reference to his other single studies on Bergson, Spinoza, Leibniz, and Nietzsche. Key topics include Deleuze's philosophical interpretation of movement and change, of time and duration, of being and becoming, of expressionism and aesthetics, of subjectivity, of the 'will to power' and the 'eternal return,' of cinema as philosophy, and of ethics. Readings accompanied by assigned films from primary representatives of art, world, and experimental cinema, related to the philosophical questions/material under examination each week.",,3,SEM,E,Graduate,In Person,Duke University,Durham,Regular Academic Session,08/25/2025,11/25/2025,Open,12,10,2,0,12,Graded,Y,Markos Hadjioannou
