class_nbr,subject,catalog_nbr,class_section,descr,catalog_description,topic,units,component,class_type,acad_career_descr,instruction_mode_descr,campus_descr,location_descr,session_descr,start_dt,end_dt,enrl_stat_descr,class_capacity,enrollment_total,enrollment_available,wait_tot,wait_cap,grading_basis,combined_section,instructors
8794,RIGHTS,107CN,01,What Rules Do We Need?,"Economic, political, and philosophical perspectives on distribution justice and the problems in each discipline raised by variations on the prisoner's dilemma. Classic texts include Hobbes and Hume, Smith and Mill, Rawls and Nozick. Main shared course for the 'What Rules Do We Need?' Constellation.",,1,LEC,E,Undergraduate,In Person,Duke University,Durham,Regular Academic Session,08/25/2025,12/05/2025,Open,65,62,3,0,65,Graded,Y,Alexander Rosenberg; Autumn Lott; Emily Annaberta Maire Kluge; Jade Yun; Tayfun Gur
6432,RIGHTS,111FS,01,Pursuit of Equality: Rethinking Schools - Lens of Social Justice,"In 1954 the Supreme Court case Brown versus the Board of Education forever changed American schools by ending segregation and creating educational equity. Or did it? Are today's schools any more inclusive or socially just than schools were 50 years ago? Examination of ways schools may or may not perpetuate and reproduce social inequities. Focus on recent efforts to imagine and create socially-just schools. Discussion of our ethical responsibilities as civically engaged citizens to work towards educational equality and provide support of schools that are inclusive, culturally responsive, and democratic. Required service-learning experience working with children in a Durham public school.",,1,SEM,E,Undergraduate,In Person,Duke University,Durham,Regular Academic Session,08/25/2025,12/05/2025,Open,18,17,1,0,18,Graded,Y,Amy Anderson
8520,RIGHTS,205,01,Introduction to Racial and Ethnic Minorities in American Politics,"The politics of four of the United States principal racial minority groups—blacks, Latinos, Asians, and American Indians.",,1,LEC,E,Undergraduate,In Person,Duke University,Durham,Regular Academic Session,08/25/2025,12/05/2025,Open,35,11,24,0,35,Graded,Y,Paula McClain
3324,RIGHTS,215,01,Sociology of Racism in America,"Examines social history of major racial groups in the US and relationships to contemporary standing. Discusses central concepts sociologists use to analyze racial matters. Central theme: 'racism' is not mere 'prejudice,' 'ignorance,' or 'intolerance,' but a comprehensive historical system of racial domination organized around the logic of white supremacy. Discussion of 'whiteness' in the USA—how whiteness emerged as a social category, an identity based on experiences of variety of European 'peoples;' how it dominated the racial structure of the US since the 17th century, how wealth has been distributed along racial lines, racialization of Asians and Latinos, and color blind racism.",,1,LEC,E,Undergraduate,In Person,Duke University,Durham,Regular Academic Session,08/25/2025,12/05/2025,Open,35,12,23,0,35,Graded,Y,Eduardo Bonilla-Silva
6437,RIGHTS,221,01,"Race, Power, and Identity: From Ali to Kaepernick","Exploration of historic and contemporary psycho-social and socio-cultural aspects of the African American sport experience. Examination of research that addresses the effect of physical differences, racial stereotyping, identity development, gender issues, and social influences on African American sport participation patterns. Analysis of sport as a microcosm of society with an emphasis on examining associated educational and societal issues.",,1,LEC,E,Undergraduate,In Person,Duke University,Durham,Regular Academic Session,08/25/2025,12/05/2025,Open,30,29,1,0,30,Graded,Y,Martin Paul Smith
7733,RIGHTS,229S,01,Environment and Conflict: The Role of the Environment in Conflict and Peacebuilding,"Environmental and natural resources as a source of conflict and/or peacebuilding between and within nations and states. Analysis of the role of the environment in the conflict cycle and international security. Topics include refugees, climate change, water, and infectious disease. Particular focus on post-conflict and rebuilding in war-torn societies. Examination of the role of international organizations, non-governmental organizations, and emerging standards for environmental management. Examples drawn from conflicts such as Rwanda, Israel/Palestine, Nepal, Sierra Leone and others. Instructor consent required.",,1,SEM,E,Undergraduate,In Person,Duke University,Durham,Regular Academic Session,08/25/2025,12/05/2025,Closed,15,15,0,0,15,Graded,Y,Erika Weinthal
6519,RIGHTS,249,01,Martin Luther King and the Prophetic Tradition,"Situates Martin Luther King as a preacher in the black Christian tradition with a liberationist reading. Traces the movement from civil rights to opposition to economic injustice, war, and militarism. Analyzes what the prophetic voices of today have to say about issues of poverty, racism, environmental destruction, militarism, homophobia, drones, sexism.",,1,LEC,E,Undergraduate,In Person,Duke University,Durham,Regular Academic Session,08/25/2025,12/05/2025,Open,12,9,3,0,12,Graded,Y,Omid Safi
6530,RIGHTS,295S,01,"Black Muslims: Race, Religion, & Culture","The intersection of African, American, European, and Islamic cultures studied through the cultural and intellectual flourishing of black Islam. Topics include early Muslim communities established in the Americas through the transatlantic slave trade, Muslim slave rebellions in Brazil and the Caribbean, Muslim slave autobiographies, African Muslims in Europe, the emergence of the Moorish Science Temple and the Nation of Islam, Elijah Muhammad, Malcolm X, Muhammad Ali, women of the Nation of Islam, women's Qur'an exegeses, Hagar as a black woman, black feminism, the Five-Percent Nation, Islamic hip-hop and rap, 'the Black Crescent,' the black international and Islam, and the Black Panthers.",,1,SEM,E,Undergraduate,In Person,Duke University,Durham,Regular Academic Session,08/25/2025,12/05/2025,Open,18,0,18,0,18,Graded,Y,Ellen McLarney
7015,RIGHTS,297,01,The Holocaust,"Antisemitism and the Jewish question in Central Europe, the development of Nazi policy, the Final Solution in its different sites (ghetto, labor camps, extermination camps) and institutions (SS, Judenrat), the Holocaust's legacy. Historiographical debates and documentary research.",,1,LEC,E,Undergraduate,In Person,Duke University,Durham,Regular Academic Session,08/25/2025,12/05/2025,Open,40,15,25,0,40,Graded,Y,Mordechai Inbari
8193,RIGHTS,314S,01,"Imagining Human Rights: Science Fiction, Culture, and the Creation of Rights","This course engages students in the intersection of speculative fiction and the history of ideas about human rights and what it means to be human. Using interdisciplinary tools, including history, anthropology, and public policy, students will explore created worlds and new ways of thinking about what rights humans—and other beings—have, how those rights are proposed, and what happens when those rights are contested. The course focuses on how the imaginary influences or presages the real, allowing us to experiment with what-ifs. Students will work in Duke's Locus Archives of primary documents on 20th-century science fiction spanning writers from China, the USSR., and Japan.",,1,SEM,E,Undergraduate,In Person,Duke University,Durham,Regular Academic Session,08/25/2025,12/05/2025,Closed,18,18,0,0,18,Graded,Y,Robin Kirk
9307,RIGHTS,330,01,Global Health Ethics: Policy Choice as Value Conflict,"The primary foci of this course are: the ethics of engagement with marginalized/stigmatized populations; understanding the influence of power dynamics; and understanding the ways in which policies create structures that limit abilities. Students explore the roots of their personal value systems and those of others, in an effort to understand causes of conflict and ethical missteps in global health engagement. Involves reading texts and coming to class ready to engage in conversations and activities related to the learning objectives. Weekly 5-question quizzes help to ensure that students come to class prepared to engage with the material.",,1,LEC,E,Undergraduate,In Person,Duke University,Durham,Regular Academic Session,08/25/2025,12/05/2025,Closed,25,26,0,0,25,Graded,Y,Kathryn Whetten; -
8183,RIGHTS,346S,01,Memory Bandits,"This seminar introduces students to multiple approaches to why and how to create memory, with a focus on contributing to a project underway at Catawba Trail Farm. We are particularly interested in how to tell difficult stories of slavery, segregation, and inequality through new sites and interpretive plans. Students will conduct interviews and archival research in coordination with a Bass Connections project, 'Making Meaning at Historic Places' and the Catawba Trail Farm, a non-profit organization that builds community and addresses food insecurity through community gardening. As part of their community-building efforts, the leaders of this project are interested in reclaiming the history of the enslaved people who lived and worked on this property outside Durham.",,1,SEM,E,Undergraduate,In Person,Duke University,Durham,Regular Academic Session,08/25/2025,12/05/2025,Open,18,5,13,0,18,Graded,Y,Robin Kirk
7018,RIGHTS,352,01,"Immigrant Dreams, U.S. Realities: Immigration Policy History","Immigrants and immigration policy in the United States from 1850 to the present, with focus on origins and power of immigrant exclusion during three waves of migration: Northern European and Asian migrations between 1850 and 1880, Eastern European, Latin American, and Asian migrations, 1880-1920, and Latin American, African, and Asian migrations, post 1965. Immigrant roles in shaping policy debates, citizenship rights, labor movements, and American culture, past and present.",,1,LEC,E,Undergraduate,In Person,Duke University,Durham,Regular Academic Session,08/25/2025,12/05/2025,Open,30,23,7,0,30,Graded,Y,Gunther W Peck
3693,RIGHTS,371,01,News as a Moral Battleground,"Ethical inquiry into journalism and its effect on public discourse. Issues include accuracy, transparency, conflicts of interest and fairness. Topics include coverage of national security, government secrecy, plagiarism/fabrication, and trade-offs of anonymous sourcing.",,1,LEC,E,Undergraduate,In Person,Duke University,Durham,Regular Academic Session,08/25/2025,12/05/2025,Closed,25,28,0,0,25,Graded,Y,William R Adair; -
2938,RIGHTS,387,01,Germany Confronts Nazism and the Holocaust,"The ways in which official German culture comes to terms with its Nazi past. Background reading in history and politics; primary focus on films, dramas, novels, and poetry, as well as public memorials, monuments, and museums. Authors treated include: Wolfgang Borchert, Rolf Hochhuth, Peter Weiss, Ruth Klüger. Taught in English.",,1,LEC,E,Undergraduate,In Person,Duke University,Durham,Regular Academic Session,08/25/2025,12/05/2025,Open,30,17,13,0,30,Graded,Y,Kata Gellen; Dylan Cameron Peter
4876,RIGHTS,395,01,Language and Society,"Course examines language as a social practice, focusing on different aspects of its role in social life. Topics addressed include: language and social identity, such as ethnicity, social class, age, and gender; variation in language, including dialects, accents, and registers; multilingualism and language contact; new languages such as pidgins and creoles; language, culture, and intercultural communication; language and ideology; language in education and in the media. Through the discussion of these topics and homework including reading and small research projects, students are introduced to key concepts, theories, and methods in sociolinguistics and linguistic anthropology.",,1,LEC,E,Undergraduate,In Person,Duke University,Durham,Regular Academic Session,08/25/2025,12/05/2025,Open,25,14,11,0,25,Graded,Y,Dominika Marta Baran
4882,RIGHTS,396S,01,Language in Immigrant America,"Discussion of issues of language in the context of immigration in the United States, from the turn of the 20th century until the present, combining approaches from literature, memoirs, language policy, media studies, and linguistic anthropology. Some fieldwork in an immigrant community. Topics include: identity, assimilation, race, bilingual communities, bilingual education, foreign accents, language contact.",,1,SEM,E,Undergraduate,In Person,Duke University,Durham,Regular Academic Session,08/25/2025,12/05/2025,Open,15,10,5,0,15,Graded,Y,Dominika Marta Baran
8771,RIGHTS,444,01,Global Inequality Research,"Engagement of vertically integrated research teams in projects exploring racial and ethnic disparities exhibited and expressed in six arenas, employment, wealth, health, political participation, education, and arts and culture. Each team will produce a major paper that will qualify for submission to a refereed journal in the area (relevant to the focus of the study. Course is not open to students who have taken Public Policy 645 or 645S.",,1,LEC,E,Undergraduate,In Person,Duke University,Durham,Regular Academic Session,08/25/2025,12/05/2025,Open,24,12,12,0,24,Graded,Y,Jocelyn H Olcott; William A Darity Jr.; -
8854,RIGHTS,642,01,Global Inequality Research,"Engagement of vertically integrated research teams in projects exploring racial and ethnic disparities exhibited and expressed in six arenas: employment, wealth, health, political participation, education, and arts and culture. Each team will produce a major paper that will qualify for submission to a refereed journal in the area relevant to the focus of the study.",,3,LEC,E,Graduate,In Person,Duke University,Durham,Regular Academic Session,08/25/2025,11/25/2025,Open,24,16,8,0,24,Graded,Y,Jocelyn H Olcott; William A Darity Jr.; -
8256,RIGHTS,660,01,Global Mental Health,"Examination of global mental health from perspectives of culture, public health, epidemiology, human rights, policy, and intervention. Disciplines include cross-cultural psychiatry, medical anthropology, public mental health, and economics. Topics include ethics, stigma, cross-cultural classification of mental health, ethnopsychology, trauma, violence, disasters, and displacement. Populations include children, ethnic minorities, refugees, survivors of complex emergencies, and persons with chronic disease. Course highlights mixed-methods approaches to research and intervention evaluation. Designed for graduate students & advanced undergraduates. Prior research methods course recommended.",,3,LEC,E,Graduate,In Person,Duke University,Durham,Regular Academic Session,08/25/2025,11/25/2025,Open,35,18,17,0,35,Graded,Y,Brandon Alyn Knettel
