filename,semester,course,instructor,question_number,question_text,response_rate,mean,std,median,total_responses,response_distribution
AEROSCI-101-01_Allen__Ryan_Fall_2024.html,Fall 2024,AEROSCI-101-01 : HERITAGE/VALUES US AIR FORCE.AEROSCI-101-01.,Ryan Allen,1,"What knowledge, methods, skills, insights, or ways of thinking did you develop in this course? Please describe three specific things you learned.",,,,,,
AEROSCI-101-01_Allen__Ryan_Fall_2024.html,Fall 2024,AEROSCI-101-01 : HERITAGE/VALUES US AIR FORCE.AEROSCI-101-01.,Ryan Allen,2,"Reflecting on the overall learning environment of this class, in what ways did the instructor(s) and the structure or components of the course facilitate your learning? Are there specific course components or methods of instruction you’d keep for future years?",,,,,,
AEROSCI-101-01_Allen__Ryan_Fall_2024.html,Fall 2024,AEROSCI-101-01 : HERITAGE/VALUES US AIR FORCE.AEROSCI-101-01.,Ryan Allen,3,"The course was intellectually stimulating. It made me think in new ways, encouraged me to adopt different points of view, or challenged me to develop new skills.",8/22 (36.36%),4.50,0.53,4.50,8,Poor: 0 (0.00%); Marginal: 0 (0.00%); Average: 0 (0.00%); Very Good: 4 (50.00%); Excellent: 4 (50.00%)
AEROSCI-101-01_Allen__Ryan_Fall_2024.html,Fall 2024,AEROSCI-101-01 : HERITAGE/VALUES US AIR FORCE.AEROSCI-101-01.,Ryan Allen,4,What made this class stimulating or how could it be more intellectually stimulating if it wasn’t?,,,,,,
AEROSCI-101-01_Allen__Ryan_Fall_2024.html,Fall 2024,AEROSCI-101-01 : HERITAGE/VALUES US AIR FORCE.AEROSCI-101-01.,Ryan Allen,5,"Considering all components of the course (lectures, discussions, sections/labs, assessments, projects, course environment, etc), overall the course was",8/22 (36.36%),4.88,0.35,5.00,8,Poor: 0 (0.00%); Marginal: 0 (0.00%); Average: 0 (0.00%); Very Good: 1 (12.50%); Excellent: 7 (87.50%)
AEROSCI-101-01_Allen__Ryan_Fall_2024.html,Fall 2024,AEROSCI-101-01 : HERITAGE/VALUES US AIR FORCE.AEROSCI-101-01.,Ryan Allen,6,"Based on the effectiveness of instruction (clarity, expertise, enthusiasm, rigor, support, inspiration, etc), overall the instructor,  Instructor(s), was",8/22 (36.36%),4.88,0.35,5.00,8,Poor: 0 (0.00%); Marginal: 0 (0.00%); Average: 0 (0.00%); Very Good: 1 (12.50%); Excellent: 7 (87.50%)
AEROSCI-101-01_Allen__Ryan_Fall_2024.html,Fall 2024,AEROSCI-101-01 : HERITAGE/VALUES US AIR FORCE.AEROSCI-101-01.,Ryan Allen,7,What would you like to say about this course to a student who is considering taking it in the future?,,,,,,
AEROSCI-101-01_Allen__Ryan_Fall_2024.html,Fall 2024,AEROSCI-101-01 : HERITAGE/VALUES US AIR FORCE.AEROSCI-101-01.,Ryan Allen,8,The course was difficult.,8/22 (36.36%),1.88,0.64,2.00,8,Strongly disagree: 2 (25.00%); Disagree: 5 (62.50%); Neither agree nor disagree: 1 (12.50%); Agree: 0 (0.00%); Strongly agree: 0 (0.00%)
AEROSCI-101-01_Allen__Ryan_Fall_2024.html,Fall 2024,AEROSCI-101-01 : HERITAGE/VALUES US AIR FORCE.AEROSCI-101-01.,Ryan Allen,9,How many hours in a typical week did you spend on this course (outside of class meetings)?,8/22 (36.36%),1.50,0.76,1.00,8,1: 5 (62.50%); 2: 2 (25.00%); 3: 1 (12.50%); 4: 0 (0.00%); 5: 0 (0.00%); 6: 0 (0.00%); 7: 0 (0.00%); 8: 0 (0.00%); 9: 0 (0.00%); 10+: 0 (0.00%)
