class_nbr,subject,catalog_nbr,class_section,descr,catalog_description,topic,units,component,class_type,acad_career_descr,instruction_mode_descr,campus_descr,location_descr,session_descr,start_dt,end_dt,enrl_stat_descr,class_capacity,enrollment_total,enrollment_available,wait_tot,wait_cap,grading_basis,combined_section,instructors
8302,AADS,90S,01,Special Topics in AADS,Course topics vary semester to semester,THE POST-APOCALYPTIC PACIFIC,1,SEM,E,Undergraduate,In Person,Duke University,Durham,Regular Academic Session,01/08/2025,04/23/2025,Closed,15,15,0,0,15,Graded,Y,Yeonwoo Koo
8150,AADS,138,01,Popular Music of Asia and Asian America,"In-depth examinations of key popular music genres from Japan, the two Koreas, China, Taiwan and Hong Kong, and Asian America. We will learn to listen analytically, and to situate our listening within each genre's or artist's cultural, historical, and political contexts. Through music, we also investigate questions migration and transnationalism; modernity and tradition; mediation and circulation; and the making of intersectional identities. No music background is required, but a willingness to listen to music is necessary.",,1,LEC,E,Undergraduate,In Person,Duke University,Durham,Regular Academic Session,01/08/2025,04/23/2025,Open,27,25,2,0,27,Graded,Y,Yun Emily Wang; Maako Shiratori
2812,AADS,201,01,Introduction to Asian American and Diaspora Studies,"What does it mean to be Asian American? Asian American Studies is an interdisciplinary field that draws on social sciences, humanities, and the arts to explore the historical and contemporary experiences of Asian Americans in the western hemisphere. This course provides students with an introduction to this dynamic and growing field of study, taking race, gender, immigration, diaspora, class, labor, and sexuality as primary subjects of the field. The course also historicizes Asian American racialization to better understand the structural forces that have shaped Asian American lives and the ways that writers, scholars, and activists have responded to and resisted these forces.",,1,LEC,E,Undergraduate,In Person,Duke University,Durham,Regular Academic Session,01/08/2025,04/23/2025,Open,25,17,8,0,25,Graded,Y,Jaeyeon Yoo
7771,AADS,229S,01,Asian American Community History,"How have Asian Americans built communities in the United States in the 19th and 20th century? This course explores the institutions, politics, cultural fabric, social relationships, and conflicts that have characterized East, South, and Southeast Asian American communities in the United States.",,1,SEM,E,Undergraduate,In Person,Duke University,Durham,Regular Academic Session,01/08/2025,04/23/2025,Open,18,16,2,0,18,Graded,Y,Calvin R Cheung-Miaw
2814,AADS,320S,01,Asian American and Latinx Literature and Film,"This course explores literary and film productions that express some of the fundamental issues affecting Asian American and Latinx communities, focusing on the ways they have been shaped in mutual relation with each other and with common histories of imperialism, militarism, labor, and immigration law.",,1,SEM,E,Undergraduate,In Person,Duke University,Durham,Regular Academic Session,01/08/2025,04/23/2025,Open,18,17,1,0,18,Graded,Y,Sandra Edith Sotelomiller; Susan B Thananopavarn
7073,AADS,364S,01,"Race, Gender, and Sexuality","Gender's relationship to race and sexuality explored through a variety of issues, including health, intimacy, family, the state, economic practices, transnational communities and identities, and social movement.",,1,SEM,E,Undergraduate,In Person,Duke University,Durham,Regular Academic Session,01/08/2025,04/23/2025,Open,18,15,3,0,18,Graded,Y,Nikki Lane
3284,AADS,452,01,Contemporary Chinese Dance in the Diaspora,"'Contemporary Chinese Dance in the Diaspora' is a studio and seminar combined course designed to introduce students to Chinese dance techniques within contemporary dance practices. Each class will commence with a comprehensive dance technique session, followed by discussions centered on readings, films, and documented dance performances. Through these activities, the course provides an opportunity to explore how dance facilitates dialogue about identity formation and cultural belonging while also serving as a powerful platform for political activism within diasporic communities.",,1,STU,E,Undergraduate,In Person,Duke University,Durham,Regular Academic Session,01/08/2025,04/23/2025,Open,15,3,12,0,15,Graded,Y,Jingqiu Guan
