filename,semester,course,instructor,question_number,question_text,response_rate,mean,std,median,total_responses,response_distribution
CELLBIO-451-01_Carbrey__Jennifer_Summer_II_2024.html,Summer II 2024,CELLBIO-451-01 : INTRO HUMAN PHYSIOLOGY.CELLBIO-451-01.,Jennifer Carbrey,1,"What knowledge, methods, skills, insights, or ways of thinking did you develop in this course? Please describe three specific things you learned.",,,,,,
CELLBIO-451-01_Carbrey__Jennifer_Summer_II_2024.html,Summer II 2024,CELLBIO-451-01 : INTRO HUMAN PHYSIOLOGY.CELLBIO-451-01.,Jennifer Carbrey,2,"Reflecting on the overall learning environment of this class, in what ways did the instructor(s) and the structure or components of the course facilitate your learning? Are there specific course components or methods of instruction you’d keep for future years?",,,,,,
CELLBIO-451-01_Carbrey__Jennifer_Summer_II_2024.html,Summer II 2024,CELLBIO-451-01 : INTRO HUMAN PHYSIOLOGY.CELLBIO-451-01.,Jennifer Carbrey,3,"The course was intellectually stimulating. It made me think in new ways, encouraged me to adopt different points of view, or challenged me to develop new skills.",7/43 (16.28%),4.86,0.38,5.00,7,Poor: 0 (0.00%); Marginal: 0 (0.00%); Average: 0 (0.00%); Very Good: 1 (14.29%); Excellent: 6 (85.71%)
CELLBIO-451-01_Carbrey__Jennifer_Summer_II_2024.html,Summer II 2024,CELLBIO-451-01 : INTRO HUMAN PHYSIOLOGY.CELLBIO-451-01.,Jennifer Carbrey,4,What made this class stimulating or how could it be more intellectually stimulating if it wasn’t?,,,,,,
CELLBIO-451-01_Carbrey__Jennifer_Summer_II_2024.html,Summer II 2024,CELLBIO-451-01 : INTRO HUMAN PHYSIOLOGY.CELLBIO-451-01.,Jennifer Carbrey,5,"Considering all components of the course (lectures, discussions, sections/labs, assessments, projects, course environment, etc), overall the course was",7/43 (16.28%),4.71,0.76,5.00,7,Poor: 0 (0.00%); Marginal: 0 (0.00%); Average: 1 (14.29%); Very Good: 0 (0.00%); Excellent: 6 (85.71%)
CELLBIO-451-01_Carbrey__Jennifer_Summer_II_2024.html,Summer II 2024,CELLBIO-451-01 : INTRO HUMAN PHYSIOLOGY.CELLBIO-451-01.,Jennifer Carbrey,6,"Based on the effectiveness of instruction (clarity, expertise, enthusiasm, rigor, support, inspiration, etc), overall the instructor,  Instructor(s), was",7/43 (16.28%),4.86,0.38,5.00,7,Poor: 0 (0.00%); Marginal: 0 (0.00%); Average: 0 (0.00%); Very Good: 1 (14.29%); Excellent: 6 (85.71%)
CELLBIO-451-01_Carbrey__Jennifer_Summer_II_2024.html,Summer II 2024,CELLBIO-451-01 : INTRO HUMAN PHYSIOLOGY.CELLBIO-451-01.,Jennifer Carbrey,7,What would you like to say about this course to a student who is considering taking it in the future?,,,,,,
CELLBIO-451-01_Carbrey__Jennifer_Summer_II_2024.html,Summer II 2024,CELLBIO-451-01 : INTRO HUMAN PHYSIOLOGY.CELLBIO-451-01.,Jennifer Carbrey,8,The course was difficult.,6/43 (13.95%),3.50,1.22,4.00,6,Strongly disagree: 0 (0.00%); Disagree: 2 (33.33%); Neither agree nor disagree: 0 (0.00%); Agree: 3 (50.00%); Strongly agree: 1 (16.67%)
CELLBIO-451-01_Carbrey__Jennifer_Summer_II_2024.html,Summer II 2024,CELLBIO-451-01 : INTRO HUMAN PHYSIOLOGY.CELLBIO-451-01.,Jennifer Carbrey,9,How many hours in a typical week did you spend on this course (outside of class meetings)?,7/43 (16.28%),7.00,2.31,6.00,7,1: 0 (0.00%); 2: 0 (0.00%); 3: 0 (0.00%); 4: 0 (0.00%); 5: 3 (42.86%); 6: 1 (14.29%); 7: 0 (0.00%); 8: 1 (14.29%); 9: 0 (0.00%); 10+: 2 (28.57%)
