class_nbr,subject,catalog_nbr,class_section,descr,catalog_description,topic,units,component,class_type,acad_career_descr,instruction_mode_descr,campus_descr,location_descr,session_descr,start_dt,end_dt,enrl_stat_descr,class_capacity,enrollment_total,enrollment_available,wait_tot,wait_cap,grading_basis,combined_section,instructors
3573,RIGHTS,104,01,Introduction to Human Rights: Gateway for the Human Rights Certificate,"This is the Gateway course for the Human Rights Certificate. Students are introduced to the history, theory, practice of, and current issues in human rights. The course is interdisciplinary.",,1,LEC,E,Undergraduate,In Person,Duke University,Durham,Regular Academic Session,01/08/2025,04/23/2025,Closed,25,25,0,0,25,Graded,Y,Robin Kirk
3611,RIGHTS,109,01,American Indians Go Graphic,"Introductory-level American Indian Studies course that explores historic and contemporary Native Nation-centric topics through the medium of comic books and graphic novels. These topics include representation and racialization, differing forms of activism, economic development, and settler-colonial impacts.",,1,LEC,E,Undergraduate,In Person,Duke University,Durham,Regular Academic Session,01/08/2025,04/23/2025,Open,25,9,16,0,25,Graded,Y,Courtney Lewis
3569,RIGHTS,148,01,Israel/Palestine: Comparative Approaches to Rights and Justice,"Introduction to the Israel/Palestine conflict, studied through an interdisciplinary lens, including scholarship from the fields of anthropology, environmental studies, history, geography and cultural studies. Themes include: competing nationalisms, environmental politics and resource management, peace building, refugees and displacement, humanitarian crises and challenges, representational politics. Range of primary sources will be used including human rights reports and testimonials, natural resource policies, feature and documentary film, memoirs, political treatises, and maps.",,1,LEC,E,Undergraduate,In Person,Duke University,Durham,Regular Academic Session,01/08/2025,04/23/2025,Closed,21,21,0,0,21,Graded,Y,Erika Weinthal; Rebecca Stein
4978,RIGHTS,156S,01,Gateway Seminar: Cold War America,"A gateway seminar designed to introduce undergraduates to historical analysis, research, and writing through study of one of the most gripping and hotly debated periods of modern history: the early Cold War contest between the US and the USSR. The course will examine both foreign relations and domestic life, with a focus on the searing impact of a politics of fear. We will explore areas ranging from the dropping of the atomic bomb to McCarthyism, from the crippling of the civil rights movement and the purge of gays from government employment to the devastating 1950s interventions in Iran, Guatemala, and Vietnam.",,1,SEM,E,Undergraduate,In Person,Duke University,Durham,Regular Academic Session,01/08/2025,04/23/2025,Open,18,15,3,0,18,Graded,Y,Nancy K MacLean
6451,RIGHTS,213,01,United States Environmental Policy,"An overview of the major environmental legislation in the United States. Topics include: air and water pollution, hazardous waste, agriculture, wildlife, and institutions. Political, economic, ethical, and scientific analysis. Open to juniors or seniors or by consent of instructor.",,1,LEC,E,Undergraduate,In Person,Duke University,Durham,Regular Academic Session,01/08/2025,04/23/2025,Closed,40,41,0,0,40,Graded,Y,Betsy Ann Albright
4966,RIGHTS,297,01,The Holocaust,"Antisemitism and the Jewish question in Central Europe, the development of Nazi policy, the Final Solution in its different sites (ghetto, labor camps, extermination camps) and institutions (SS, Judenrat), the Holocaust's legacy. Historiographical debates and documentary research.",,1,LEC,E,Undergraduate,In Person,Duke University,Durham,Regular Academic Session,01/08/2025,04/23/2025,Open,25,21,4,0,25,Graded,Y,Mordechai Inbari
4062,RIGHTS,303S,01,De/Re/Segregation in Education: A Case of Back to the Future?,"Course traces timeline of segregation, desegregation, integration and resegregation in education in the United States, from policies and practices first enacted at this nation's birth through current policies and practices that challenge our commitments to opportunity, equality, and equity. Course invites students to study historical and contemporary practices in education, comparing segregation and resegregation as moments in the education history of the US, taking recent developments in North Carolina education policy and practice as cases to enrich understanding. Students engage in a minimum of 20 hours of planned service activities.",,1,SEM,E,Undergraduate,In Person,Duke University,Durham,Regular Academic Session,01/08/2025,04/23/2025,Open,18,14,4,0,18,Graded,Y,Amy Anderson
6770,RIGHTS,315-20,01,Engineering Sustainable Design and the Global Community: Structural Focus,"Design and testing of solutions to complex interdisciplinary design products in a service-learning context with a focus on structural products. Technical design principles; sustainable and engineering best practices; prototype formation, testing and evaluation; and establishment of research and analysis methodologies in a community-based research experience. Working in partnership with a community agency (local, national, or international) and participation in an experimental learning process by engineering a design solution for an identified community need. Evaluation focused on design deliverables, fabricated prototypes and a critical reflection of the experimental learning process.",,1,LEC,E,Undergraduate,In Person,Duke University,Durham,Regular Academic Session,01/08/2025,04/23/2025,Open,20,13,7,0,20,Graded,Y,David E Schaad
6774,RIGHTS,315-60,01,Engineering Sustainable Design and the Global Community: Environmental Focus,"Design and testing of solutions to complex interdisciplinary design products in a service-learning context with a focus on structural products. Technical design principles; sustainable and engineering best practices; prototype formation, testing and evaluation; and establishment of research and analysis methodologies in a community-based research experience. Working in partnership with a community agency (local, national, or international) and participation in an experimental learning process by engineering a design solution for an identified community need. Evaluation focused on design deliverables, fabricated prototypes and a critical reflection of the experimental learning process. Prerequisite: Engineering 201L or Electrical and Computer Engineering 110L or consent of instructor.",,1,LEC,E,Undergraduate,In Person,Duke University,Durham,Regular Academic Session,01/08/2025,04/23/2025,Open,20,13,7,0,20,Graded,Y,David E Schaad
3145,RIGHTS,317S,01,Veterans Oral History Project,"Explore methods of oral history, specifically focusing on interviewing U.S. military veterans who have served during times of conflict. Weekly readings concerning ethics of oral history work and the particulars of interviewing veterans. Learn techniques for conducting successful oral history interviews and master technical skills involving recording equipment. Conduct multiple interviews with veterans throughout semester. Discuss interviews and transcriptions with classmates. Assignments include written responses and a final presentation on conducted interviews. Includes a service-learning component involving work in the community.",,1,SEM,E,Undergraduate,In Person,Duke University,Durham,Regular Academic Session,01/08/2025,04/23/2025,Closed,15,15,0,0,15,Graded,Y,Michelle Lanier
6861,RIGHTS,331,01,Prisoner's Dilemma and Distributive Justice,"Economic, political, and philosophical perspectives on distribution justice and the problems in each discipline raised by variations on the prisoner's dilemma. Classic texts include Hobbes and Hume, Smith and Mill, Rawls and Nozick. Gateway course to the Politics, Philosophy, and Economics certificate program. Recommended prerequisite: Economics 101 and a course in ethics or political philosophy.",,1,LEC,E,Undergraduate,In Person,Duke University,Durham,Regular Academic Session,01/08/2025,04/23/2025,Open,130,122,8,0,130,Graded,Y,Richard Michael Salsman; Victor Crespo
4525,RIGHTS,341,01,Ethics of Global Infectious Disease Control,"Examination of the role of ethical decision-making when controlling infectious disease epidemics. Applies classic public health ethics of balancing individual liberty vs. public good to the new global health context of emerging infectious diseases such as HIV/AIDS, Ebola, and SARS, plus re-emerging infectious diseases such as multidrug-resistant TB, polio, and cholera. Explores questions of resource allocation, mandatory or voluntary prevention measures, and ethical obligations of health care workers vs. responsibilities of individuals in the context of new global public health. Prior global health coursework recommended.",,1,LEC,E,Undergraduate,In Person,Duke University,Durham,Regular Academic Session,01/08/2025,04/23/2025,Open,35,14,21,0,35,Graded,Y,Kearsley Stewart
3729,RIGHTS,351S,01,Contemporary South Africa,"Nelson Mandela's presidency in 1994 inaugurated democracy in South Africa. Using a historical lens, this course will explore the promises, possibilities, and disappointments of the democratic era. In what ways has the 1994 election slogan 'A better life for all' come to pass? Why and in what ways has the new political elite fallen short in delivering on its promises? How have segments of the public sought to impose accountability and restitution on new democratic governments, as well as on the long-standing titans of industry?",,1,SEM,E,Undergraduate,In Person,Duke University,Durham,Regular Academic Session,01/08/2025,04/23/2025,Closed,15,16,0,0,15,Graded,Y,Karin Shapiro
7081,RIGHTS,361,01,"Money, Sex, Power","Feminist research on gender dynamics in markets, economies, and capitalism. Includes empirical studies (e.g., historical, cross-cultural, and sociological research) and theoretical approaches to political-economic critique. Covered topics may include the gender, racial and transnational divisions of labor, the relation between work and family, waged household labor, sex work, sweatshop labor.",,1,LEC,E,Undergraduate,In Person,Duke University,Durham,Regular Academic Session,01/08/2025,04/23/2025,Open,25,22,3,0,25,Graded,Y,Ara Wilson
3221,RIGHTS,371,01,News as a Moral Battleground,"Ethical inquiry into journalism and its effect on public discourse. Issues include accuracy, transparency, conflicts of interest and fairness. Topics include coverage of national security, government secrecy, plagiarism/fabrication, and trade-offs of anonymous sourcing.",,1,LEC,E,Undergraduate,In Person,Duke University,Durham,Regular Academic Session,01/08/2025,04/23/2025,Closed,25,28,0,0,25,Graded,Y,Frank Anthony Bruni; -
9981,RIGHTS,371,02,News as a Moral Battleground,"Ethical inquiry into journalism and its effect on public discourse. Issues include accuracy, transparency, conflicts of interest and fairness. Topics include coverage of national security, government secrecy, plagiarism/fabrication, and trade-offs of anonymous sourcing.",,1,LEC,E,Undergraduate,In Person,Duke University,Durham,Regular Academic Session,01/08/2025,04/23/2025,Closed,25,30,0,0,25,Graded,Y,Paul C Tash
4511,RIGHTS,375,01,Global Health Ethics in Research,"Introduces ethical and human rights concepts in Global Health and current issues in health ethics. Explores how to understand and engage in ethical health service, intervention, research and education. Requires students analyze and critique ethical choices of individuals, policy-makers and health workers. Explores standards of care, access to care, best outcomes vs. distributed justice. Focuses on ethics related to infectious diseases; obesity, alcohol and tobacco; and environmental health.",,1,LEC,E,Undergraduate,In Person,Duke University,Durham,Regular Academic Session,01/08/2025,04/23/2025,Closed,40,42,0,0,40,Graded,Y,Sumedha Ariely
8551,RIGHTS,384,01,Inequality in Western Political Thought,"Study of egalitarian and inegalitarian theories in the history of Western Political Thought. Distinction between forms of inequality (political, economic, social, racial, gender, etc.). Analysis of what kind of equality should be achieved (resources, opportunities, rights, respect, etc.). Connection of equality with other political and moral issues (freedom, responsibility, class conflict, well-being, poverty, exclusion, solidarity, difference, etc.) Readings include Aristotle, Machiavelli, Locke, Rousseau, Smith, Wollstonecraft, Tocqueville, Marx, Veblen, Du Bois, Friedman, Rawls, and Piketty.",,1,LEC,E,Undergraduate,In Person,Duke University,Durham,Regular Academic Session,01/08/2025,04/23/2025,Open,24,12,12,0,24,Graded,Y,Genevieve B Rousseliere
7091,RIGHTS,386S,01,Politics of Sexuality,"Explores intersections among sexual identity, desire, and behavior and political institutions, public policy, and concepts of citizenship. Readings and methods will be interdisciplinary and will examine politics of sexuality in diverse sociocultural, international, and historical contexts. Topics may include: social movements; laws, policing, and incarceration; medicalization and eugenics; militarism and geopolitics; immigration and human rights; welfare policies; nationalism and citizenship; and reproductive rights.",,1,SEM,E,Undergraduate,In Person,Duke University,Durham,Regular Academic Session,01/08/2025,04/23/2025,Closed,18,18,0,0,18,Graded,Y,Gabriel N Rosenberg
5828,RIGHTS,409S,01,Identity and Linguistic Rights in the Spanish Speaking Americas,"This course focuses on linguistic justice and linguistic rights in interaction with other human rights. The class explores concepts of language, power, linguistic discrimination, and raciolinguistics in the context of bilingualism/multilingualism, indigenous languages, and endangered languages. We will examine how language is used to shape and negotiate identities, and how it reflects and sustains social realities and situations of social inequality. Methodologically, we will use linguistic and sociolinguistic analysis and elements of critical discourse analysis.",,1,SEM,E,Undergraduate,In Person,Duke University,Durham,Regular Academic Session,01/08/2025,04/23/2025,Closed,12,14,0,0,12,Graded,Y,Liliana Paredes
9545,RIGHTS,444S,01,Global Inequality Research Seminar,"Engagement of vertically integrated research teams in projects exploring racial and ethnic disparities exhibited and expressed in six arenas: employment, wealth, health, political participation, education, and arts and culture. Each team will produce a major paper that will qualify for submission to a refereed journal in the area relevant to the focus of the study. Course is not open to students who have taken PUBPOL 645S.",,1,SEM,E,Undergraduate,In Person,Duke University,Durham,Regular Academic Session,01/08/2025,04/23/2025,Open,18,5,13,0,18,Graded,Y,Arko Dasgupta; William A Darity Jr.
9550,RIGHTS,444S,02,Global Inequality Research Seminar,"Engagement of vertically integrated research teams in projects exploring racial and ethnic disparities exhibited and expressed in six arenas: employment, wealth, health, political participation, education, and arts and culture. Each team will produce a major paper that will qualify for submission to a refereed journal in the area relevant to the focus of the study. Course is not open to students who have taken PUBPOL 645S.",,1,SEM,E,Undergraduate,In Person,Duke University,Durham,Regular Academic Session,01/08/2025,04/23/2025,Open,18,12,6,0,18,Graded,Y,Adam Edward Hollowell; -
3589,RIGHTS,470S,01,Capstone: Research in Human Rights,"A primary learning objective is to have students connect the intellectual themes and scholarly knowledge they have developed in the Gateway, Introduction to Human Rights, and the electives they have taken toward the Human Rights Certificate. The course integrates co-curricular rights-related experiences (through DukeEngage, DukeImmerse, internships and volunteer placements). The capstone culminates in a final project. Students may work in teams toward a final project so long as each student's work is evaluated separately and at a high standard. Prerequisite: Cultural Anthropology 104D. Consent of director of undergraduate studies required.",,1,SEM,E,Undergraduate,In Person,Duke University,Durham,Regular Academic Session,01/08/2025,04/23/2025,Open,15,8,7,0,15,Graded,Y,Robin Kirk
